,verb,item,sent,bias,subject_gender,surprisal_he,surprisal_she,subject_preference
5181,hailed,10,The daughter hailed the son because,-45,0,1.641443133,2.509275913,-0.86783278
5182,harassed,10,The son harassed the daughter because,41,1,1.583808541,1.814347863,0.230539322
5183,harassed,10,The daughter harassed the son because,41,0,1.623832822,1.728079081,-0.104246259
5184,harmed,10,The son harmed the daughter because,52,1,1.533507228,2.195945978,0.66243875
5185,harmed,10,The daughter harmed the son because,52,0,1.776180625,1.875462651,-0.099282026
5186,hated,10,The son hated the daughter because,-91,1,1.848227739,1.447819114,-0.400408625
5187,hated,10,The daughter hated the son because,-91,0,1.370805621,1.887457967,-0.516652346
5188,haunted,10,The son haunted the daughter because,20,1,1.700332284,1.927690625,0.227358341
5189,haunted,10,The daughter haunted the son because,20,0,1.750844717,1.899448514,-0.148603797
5190,helped,10,The son helped the daughter because,-49,1,1.649559855,2.115954876,0.466395021
5191,helped,10,The daughter helped the son because,-49,0,1.914283037,1.647090673,0.267192364
5192,hired,10,The son hired the daughter because,-65,1,1.593912959,1.988818288,0.394905329
5193,hired,10,The daughter hired the son because,-65,0,1.712435007,1.81897068,-0.106535673
5194,hit,10,The son hit the daughter because,-14,1,1.598495603,1.841153383,0.24265778
5195,hit,10,The daughter hit the son because,-14,0,1.462857842,1.997968793,-0.535110951
5196,honoured,10,The son honoured the daughter because,-57,1,1.610654831,2.011041403,0.400386572
5197,honoured,10,The daughter honoured the son because,-57,0,1.655005336,2.042723179,-0.387717843
5198,hugged,10,The son hugged the daughter because,12,1,1.73916316,2.063910484,0.324747324
5199,hugged,10,The daughter hugged the son because,12,0,1.687071681,1.995704889,-0.308633208
5200,hurt,10,The son hurt the daughter because,47,1,1.594323635,1.982382417,0.388058782
5201,hurt,10,The daughter hurt the son because,47,0,1.479823709,2.066909313,-0.587085604
5202,idolized,10,The son idolized the daughter because,-66,1,1.853545785,2.041180134,0.187634349
5203,idolized,10,The daughter idolized the son because,-66,0,1.953136086,1.910891652,0.042244434
5204,incensed,10,The son incensed the daughter because,57,1,1.668228745,2.081702709,0.413473964
5205,incensed,10,The daughter incensed the son because,57,0,1.723300338,1.932750463,-0.209450125
5206,infuriated,10,The son infuriated the daughter because,75,1,1.485412598,1.964388371,0.478975773
5207,infuriated,10,The daughter infuriated the son because,75,0,1.644505024,1.700012684,-0.05550766
5208,inspired,10,The son inspired the daughter because,78,1,1.779524326,2.167693138,0.388168812
5209,inspired,10,The daughter inspired the son because,78,0,1.677076817,2.127324581,-0.450247764
5210,instructed,10,The son instructed the daughter because,-17,1,1.721862435,2.104593992,0.382731557
5211,instructed,10,The daughter instructed the son because,-17,0,1.811065912,1.932691932,-0.12162602
5212,insulted,10,The son insulted the daughter because,6,1,1.55989325,1.817828774,0.257935524
5213,insulted,10,The daughter insulted the son because,6,0,1.476184487,1.913686395,-0.437501908
5214,interrupted,10,The son interrupted the daughter because,3,1,1.801906228,1.820364833,0.018458605
5215,interrupted,10,The daughter interrupted the son because,3,0,1.663303614,1.876088738,-0.212785124
5216,intimidated,10,The son intimidated the daughter because,73,1,1.477326751,1.681636572,0.204309821
5217,intimidated,10,The daughter intimidated the son because,73,0,1.47201395,1.644888163,-0.172874213
5218,intrigued,10,The son intrigued the daughter because,76,1,1.582226753,2.275947094,0.693720341
5219,intrigued,10,The daughter intrigued the son because,76,0,1.813033462,1.717141271,0.095892191
5220,irritated,10,The son irritated the daughter because,81,1,1.594426394,1.878514171,0.284087777
5221,irritated,10,The daughter irritated the son because,81,0,1.576259851,1.862472057,-0.286212206
5222,killed,10,The son killed the daughter because,5,1,1.480102301,1.971570969,0.491468668
5223,killed,10,The daughter killed the son because,5,0,1.639092445,1.778087616,-0.138995171
5224,kissed,10,The son kissed the daughter because,61,1,1.694228172,1.839376092,0.14514792
5225,kissed,10,The daughter kissed the son because,61,0,1.678795218,1.740643024,-0.061847806
5226,lauded,10,The son lauded the daughter because,-37,1,2.143013716,1.941884875,-0.201128841
5227,lauded,10,The daughter lauded the son because,-37,0,1.641715646,2.814939976,-1.17322433
5228,laughed at,10,The son laughed at the daughter because,-96,1,1.708905578,1.811247706,0.102342128
5229,laughed at,10,The daughter laughed at the son because,-96,0,1.509532452,2.020923615,-0.511391163
5230,led,10,The son led the daughter because,-30,1,2.04895401,2.133520126,0.084566116
5231,led,10,The daughter led the son because,-30,0,1.86886394,2.022498131,-0.153634191
5232,left,10,The son left the daughter because,2,1,1.657811284,1.981721997,0.323910713
5233,left,10,The daughter left the son because,2,0,1.804667234,1.758702397,0.045964837
5234,lied to,10,The son lied to the daughter because,78,1,1.23142457,2.224466085,0.993041515
5235,lied to,10,The daughter lied to the son because,78,0,2.171639681,1.246389627,0.925250054
5236,liked,10,The son liked the daughter because,-91,1,1.945690274,1.255778313,-0.689911961
5237,liked,10,The daughter liked the son because,-91,0,1.088707089,2.32420826,-1.235501171
5238,loathed,10,The son loathed the daughter because,-85,1,2.0790658,1.553530812,-0.525534988
5239,loathed,10,The daughter loathed the son because,-85,0,1.475408316,2.183063269,-0.707654953
5240,loved,10,The son loved the daughter because,-80,1,1.966999292,1.210616827,-0.756382465
5241,loved,10,The daughter loved the son because,-80,0,1.118490458,2.251704931,-1.133214473
5242,married,10,The son married the daughter because,53,1,1.964258194,2.469914675,0.505656481
5243,married,10,The daughter married the son because,53,0,2.131746531,1.981018066,0.150728465
5244,met,10,The son met the daughter because,53,1,1.96835351,2.431820631,0.463467121
5245,met,10,The daughter met the son because,53,0,2.265929937,1.748628139,0.517301798
5246,missed,10,The son missed the daughter because,-45,1,1.749347329,2.207222939,0.45787561
5247,missed,10,The daughter missed the son because,-45,0,2.061472178,1.704991937,0.356480241
5248,mocked,10,The son mocked the daughter because,-33,1,1.975502133,1.762529731,-0.212972402
5249,mocked,10,The daughter mocked the son because,-33,0,1.56375134,2.216173649,-0.652422309
5250,mourned,10,The son mourned the daughter because,-72,1,2.002481699,1.983913064,-0.018568635
5251,mourned,10,The daughter mourned the son because,-72,0,1.672660112,2.413985252,-0.74132514
5252,moved,10,The son moved the daughter because,-11,1,1.795099974,2.15050149,0.355401516
5253,moved,10,The daughter moved the son because,-11,0,1.840986967,1.921458244,-0.080471277
5254,noticed,10,The son noticed the daughter because,-92,1,1.873255491,1.764265299,-0.108990192
5255,noticed,10,The daughter noticed the son because,-92,0,1.64960134,1.92475152,-0.27515018
5256,ordered around,10,The son ordered around the daughter because,53,1,1.791716814,1.819707394,0.02799058
5257,ordered around,10,The daughter ordered around the son because,53,0,1.579879761,1.894896984,-0.315017223
5258,pacified,10,The son pacified the daughter because,-49,1,1.696026802,2.01223278,0.316205978
5259,pacified,10,The daughter pacified the son because,-49,0,1.680835366,1.909723759,-0.228888393
5260,pardoned,10,The son pardoned the daughter because,-38,1,1.625666738,2.167348862,0.541682124
5261,pardoned,10,The daughter pardoned the son because,-38,0,1.958200574,1.964595675,-0.006395101
5262,passed,10,The son passed the daughter because,0,1,1.713288784,2.205406904,0.49211812
5263,passed,10,The daughter passed the son because,0,0,2.01720643,1.818686247,0.198520183
5264,penalized,10,The son penalized the daughter because,-77,1,1.742993712,2.012673616,0.269679904
5265,penalized,10,The daughter penalized the son because,-77,0,1.786022544,1.984938979,-0.198916435
5266,persecuted,10,The son persecuted the daughter because,-22,1,1.73325491,1.941384196,0.208129286
5267,persecuted,10,The daughter persecuted the son because,-22,0,1.928211451,1.808082342,0.120129109
5268,picked up,10,The son picked up the daughter because,-71,1,1.656490684,1.73308754,0.076596856
5269,picked up,10,The daughter picked up the son because,-71,0,1.575307965,1.771912932,-0.196604967
5270,plagued,10,The son plagued the daughter because,58,1,2.033358574,2.220530748,0.187172174
5271,plagued,10,The daughter plagued the son because,58,0,2.078101873,2.122569799,-0.044467926
5272,played,10,The son played the daughter because,43,1,1.664132476,2.490782976,0.8266505
5273,played,10,The daughter played the son because,43,0,2.421864748,1.648190379,0.773674369
5274,played with,10,The son played with the daughter because,-13,1,1.849704385,2.459695101,0.609990716
5275,played with,10,The daughter played with the son because,-13,0,2.195362806,1.906156778,0.289206028
5276,pleased,10,The son pleased the daughter because,83,1,1.525306702,2.013660431,0.488353729
5277,pleased,10,The daughter pleased the son because,83,0,1.585686564,1.830083489,-0.244396925
5278,praised,10,The son praised the daughter because,-87,1,2.173833609,1.659547806,-0.514285803
5279,praised,10,The daughter praised the son because,-87,0,1.473065972,2.782577753,-1.309511781
5280,prized,10,The son prized the daughter because,-74,1,1.728923202,1.826906443,0.097983241
5281,prized,10,The daughter prized the son because,-74,0,1.747147918,1.918745279,-0.171597361
5282,prosecuted,10,The son prosecuted the daughter because,-44,1,1.7376858,2.157114267,0.419428467
5283,prosecuted,10,The daughter prosecuted the son because,-44,0,1.893892527,1.952856541,-0.058964014
5284,protected,10,The son protected the daughter because,-47,1,1.739601135,2.026484489,0.286883354
5285,protected,10,The daughter protected the son because,-47,0,1.856247187,1.821245193,0.035001994
5286,provoked,10,The son provoked the daughter because,70,1,1.5182302,1.824155688,0.305925488
5287,provoked,10,The daughter provoked the son because,70,0,1.541904092,1.704244614,-0.162340522
5288,punished,10,The son punished the daughter because,-76,1,1.721979022,1.628310323,-0.093668699
5289,punished,10,The daughter punished the son because,-76,0,1.446003556,1.978252888,-0.532249332
5290,pursued,10,The son pursued the daughter because,31,1,1.641785383,1.808781981,0.166996598
5291,pursued,10,The daughter pursued the son because,31,0,1.706853867,1.696562409,0.010291458
5292,questioned,10,The son questioned the daughter because,26,1,1.923436046,2.030478001,0.107041955
5293,questioned,10,The daughter questioned the son because,26,0,1.866741657,2.091876745,-0.225135088
5294,reassured,10,The son reassured the daughter because,-62,1,1.776265383,2.596124649,0.819859266
5295,reassured,10,The daughter reassured the son because,-62,0,2.042283535,1.994788885,0.04749465
5296,rebuked,10,The son rebuked the daughter because,-18,1,1.942490101,1.812575698,-0.129914403
5297,rebuked,10,The daughter rebuked the son because,-18,0,1.674043298,2.110653639,-0.436610341
5298,relaxed,10,The son relaxed the daughter because,19,1,1.849461317,2.031064034,0.181602717
5299,relaxed,10,The daughter relaxed the son because,19,0,1.847298503,1.939811468,-0.092512965
5300,relished,10,The son relished the daughter because,-47,1,1.790472865,1.772916913,-0.017555952
5301,relished,10,The daughter relished the son because,-47,0,1.630674124,2.046789646,-0.416115522
5302,repaid,10,The son repaid the daughter because,63,1,1.543320417,1.812438846,0.269118429
5303,repaid,10,The daughter repaid the son because,63,0,1.731066942,1.648515224,0.082551718
5304,repelled,10,The son repelled the daughter because,67,1,1.79092133,2.095173836,0.304252506
5305,repelled,10,The daughter repelled the son because,67,0,1.870935917,1.788175225,0.082760692
5306,reprimanded,10,The son reprimanded the daughter because,-50,1,1.856118321,1.783219695,-0.072898626
5307,reprimanded,10,The daughter reprimanded the son because,-50,0,1.54255116,2.13668108,-0.59412992
5308,repulsed,10,The son repulsed the daughter because,76,1,1.667665839,1.910285234,0.242619395
5309,repulsed,10,The daughter repulsed the son because,76,0,1.618717909,1.849367261,-0.230649352
5310,resented,10,The son resented the daughter because,-76,1,1.705760956,1.90585506,0.200094104
5311,resented,10,The daughter resented the son because,-76,0,1.732884407,1.814379454,-0.081495047
5312,respected,10,The son respected the daughter because,-91,1,1.633103013,1.851237535,0.218134522
5313,respected,10,The daughter respected the son because,-91,0,1.596920609,1.94875586,-0.351835251
5314,revered,10,The son revered the daughter because,-57,1,1.802230597,1.973288655,0.171058058
5315,revered,10,The daughter revered the son because,-57,0,1.825071216,2.014807701,-0.189736485
5316,revitalized,10,The son revitalized the daughter because,3,1,2.037439346,2.200022221,0.162582875
5317,revitalized,10,The daughter revitalized the son because,3,0,1.956797957,2.152104139,-0.195306182
5318,revolted,10,The son revolted the daughter because,66,1,1.734798551,1.822303414,0.087504863
5319,revolted,10,The daughter revolted the son because,66,0,1.718649864,1.857050419,-0.138400555
5320,rewarded,10,The son rewarded the daughter because,-85,1,1.566615701,1.693426132,0.126810431
5321,rewarded,10,The daughter rewarded the son because,-85,0,1.468571305,1.816796422,-0.348225117
5322,ridiculed,10,The son ridiculed the daughter because,-58,1,1.969427347,1.739669442,-0.229757905
5323,ridiculed,10,The daughter ridiculed the son because,-58,0,1.579725862,2.145127773,-0.565401911
5324,rushed to,10,The son rushed to the daughter because,-32,1,1.679365516,1.909706712,0.230341196
5325,rushed to,10,The daughter rushed to the son because,-32,0,1.805916548,1.659469843,0.146446705
5326,saluted,10,The son saluted the daughter because,-48,1,1.778007984,1.925379157,0.147371173
5327,saluted,10,The daughter saluted the son because,-48,0,1.57822907,2.212192774,-0.633963704
5328,scared,10,The son scared the daughter because,74,1,1.603190422,1.629716992,0.02652657
5329,scared,10,The daughter scared the son because,74,0,1.288599253,2.005081654,-0.716482401
5330,scolded,10,The son scolded the daughter because,-69,1,2.0060215,1.814006448,-0.192015052
5331,scolded,10,The daughter scolded the son because,-69,0,1.592311502,2.195731401,-0.603419899
5332,scorned,10,The son scorned the daughter because,-49,1,1.953254461,1.696837902,-0.256416559
5333,scorned,10,The daughter scorned the son because,-49,0,1.555020928,2.094226599,-0.539205671
5334,shadowed,10,The son shadowed the daughter because,58,1,1.902235746,2.309061527,0.406825781
5335,shadowed,10,The daughter shadowed the son because,58,0,2.107803345,1.910064459,0.197738886
5336,shocked,10,The son shocked the daughter because,56,1,1.492594004,2.035387754,0.54279375
5337,shocked,10,The daughter shocked the son because,56,0,1.528832555,1.866314769,-0.337482214
5338,shook,10,The son shook the daughter because,-47,1,1.771766782,1.891147494,0.119380712
5339,shook,10,The daughter shook the son because,-47,0,1.516820312,2.197145224,-0.680324912
5340,snubbed,10,The son snubbed the daughter because,20,1,1.650185823,2.129150629,0.478964806
5341,snubbed,10,The daughter snubbed the son because,20,0,1.694326162,1.888872862,-0.1945467
5342,staggered,10,The son staggered the daughter because,64,1,1.792960763,2.273389339,0.480428576
5343,staggered,10,The daughter staggered the son because,64,0,1.8205688,2.013959885,-0.193391085
5344,startled,10,The son startled the daughter because,35,1,1.54407239,1.974452853,0.430380463
5345,startled,10,The daughter startled the son because,35,0,1.534101725,1.875447392,-0.341345667
5346,stimulated,10,The son stimulated the daughter because,30,1,1.693623185,2.161294937,0.467671752
5347,stimulated,10,The daughter stimulated the son because,30,0,1.667111397,1.879390359,-0.212278962
5348,struck,10,The son struck the daughter because,-8,1,1.681475997,1.898762941,0.217286944
5349,struck,10,The daughter struck the son because,-8,0,1.530926466,1.985444903,-0.454518437
5350,sued,10,The son sued the daughter because,-77,1,1.602462888,2.10146594,0.499003052
5351,sued,10,The daughter sued the son because,-77,0,1.674456358,1.907450318,-0.23299396
5352,supported,10,The son supported the daughter because,-29,1,1.649009585,2.635568142,0.986558557
5353,supported,10,The daughter supported the son because,-29,0,2.016769409,1.743424296,0.273345113
5354,surprised,10,The son surprised the daughter because,10,1,1.545868993,1.951164603,0.40529561
5355,surprised,10,The daughter surprised the son because,10,0,1.570491076,1.806864023,-0.236372947
5356,tailed,10,The son tailed the daughter because,58,1,1.79534483,2.293087482,0.497742652
5357,tailed,10,The daughter tailed the son because,58,0,1.887662649,1.945834041,-0.058171392
5358,telephoned,10,The son telephoned the daughter because,82,1,1.578928351,2.121667147,0.542738796
5359,telephoned,10,The daughter telephoned the son because,82,0,1.779383421,1.74155283,0.037830591
5360,thanked,10,The son thanked the daughter because,-92,1,1.757230997,1.708261251,-0.048969746
5361,thanked,10,The daughter thanked the son because,-92,0,1.470458865,2.125313759,-0.654854894
5362,tolerated,10,The son tolerated the daughter because,4,1,1.706541061,1.688852906,-0.017688155
5363,tolerated,10,The daughter tolerated the son because,4,0,1.623844862,1.708697081,-0.084852219
5364,took away,10,The son took away the daughter because,-50,1,1.541725755,1.887375116,0.345649361
5365,took away,10,The daughter took away the son because,-50,0,1.604596138,1.753673434,-0.149077296
5366,tormented,10,The son tormented the daughter because,45,1,1.738256812,1.980683565,0.242426753
5367,tormented,10,The daughter tormented the son because,45,0,1.773439646,1.915439606,-0.14199996
5368,tracked,10,The son tracked the daughter because,36,1,1.742078662,1.972056627,0.229977965
5369,tracked,10,The daughter tracked the son because,36,0,1.781282783,1.824440837,-0.043158054
5370,trailed,10,The son trailed the daughter because,66,1,1.87816155,2.413294315,0.535132765
5371,trailed,10,The daughter trailed the son because,66,0,2.068024874,1.885828018,0.182196856
5372,treasured,10,The son treasured the daughter because,-76,1,1.87538147,1.631633878,-0.243747592
5373,treasured,10,The daughter treasured the son because,-76,0,1.487798572,2.188364983,-0.700566411
5374,troubled,10,The son troubled the daughter because,68,1,1.694385648,2.180218697,0.485833049
5375,troubled,10,The daughter troubled the son because,68,0,1.874114275,1.933595419,-0.059481144
5376,trusted,10,The son trusted the daughter because,-49,1,1.61544776,1.866746187,0.251298427
5377,trusted,10,The daughter trusted the son because,-49,0,1.687259078,1.699421644,-0.012162566
5378,unnerved,10,The son unnerved the daughter because,70,1,1.603723168,2.129478216,0.525755048
5379,unnerved,10,The daughter unnerved the son because,70,0,1.747323036,1.846065879,-0.098742843
5380,unsettled,10,The son unsettled the daughter because,62,1,1.870366454,2.241837978,0.371471524
5381,unsettled,10,The daughter unsettled the son because,62,0,1.900337458,2.063041449,-0.162703991
5382,uplifted,10,The son uplifted the daughter because,-1,1,1.923051715,2.371219158,0.448167443
5383,uplifted,10,The daughter uplifted the son because,-1,0,1.810328603,2.208778143,-0.39844954
5384,upset,10,The son upset the daughter because,66,1,1.531560779,2.006882191,0.475321412
5385,upset,10,The daughter upset the son because,66,0,1.577094674,1.87944293,-0.302348256
5386,valued,10,The son valued the daughter because,-98,1,1.710060596,1.832974553,0.122913957
5387,valued,10,The daughter valued the son because,-98,0,1.530545592,2.04041791,-0.509872318
5388,venerated,10,The son venerated the daughter because,-32,1,1.95849216,1.8699857,-0.08850646
5389,venerated,10,The daughter venerated the son because,-32,0,1.986833572,1.96891427,0.017919302
5390,victimized,10,The son victimized the daughter because,15,1,1.495727777,2.107028484,0.611300707
5391,victimized,10,The daughter victimized the son because,15,0,1.704930782,1.843562603,-0.138631821
5392,vilified,10,The son vilified the daughter because,26,1,1.870211244,2.022716999,0.152505755
5393,vilified,10,The daughter vilified the son because,26,0,1.852715611,2.13752985,-0.284814239
5394,visited,10,The son visited the daughter because,-45,1,1.60628891,2.113442421,0.507153511
5395,visited,10,The daughter visited the son because,-45,0,1.886479855,1.644801617,0.241678238
5396,wanted,10,The son wanted the daughter because,-26,1,1.462835789,1.837411165,0.374575376
5397,wanted,10,The daughter wanted the son because,-26,0,1.674135089,1.605562091,0.068572998
5398,warned,10,The son warned the daughter because,-17,1,2.11748147,2.486212254,0.368730784
5399,warned,10,The daughter warned the son because,-17,0,2.185333967,2.46354413,-0.278210163
5400,welcomed,10,The son welcomed the daughter because,-17,1,1.7046597,2.156492472,0.451832772
5401,welcomed,10,The daughter welcomed the son because,-17,0,1.722422481,1.95838809,-0.235965609
5402,worried,10,The son worried the daughter because,76,1,1.863901377,1.929612517,0.06571114
5403,worried,10,The daughter worried the son because,76,0,1.667293906,2.077564716,-0.41027081
5404,worried about,10,The son worried about the daughter because,-71,1,1.848180532,1.868796468,0.020615936
5405,worried about,10,The daughter worried about the son because,-71,0,1.663250089,1.897465706,-0.234215617
5406,worshipped,10,The son worshipped the daughter because,-54,1,1.937193871,1.896798611,-0.04039526
5407,worshipped,10,The daughter worshipped the son because,-54,0,2.02652669,1.7774297,0.24909699
5408,wounded,10,The son wounded the daughter because,33,1,1.612386823,1.963143468,0.350756645
5409,wounded,10,The daughter wounded the son because,33,0,1.540784359,2.11109519,-0.570310831
5410,yelled at,10,The son yelled at the daughter because,-57,1,1.755348444,1.586987138,-0.168361306
5411,yelled at,10,The daughter yelled at the son because,-57,0,1.330134273,2.064293861,-0.734159588
5412,abandoned,11,The nephew abandoned the niece because,33,1,1.739264011,1.882056355,0.142792344
5413,abandoned,11,The niece abandoned the nephew because,33,0,1.742092252,1.845953226,-0.103860974
5414,acclaimed,11,The nephew acclaimed the niece because,-58,1,1.864373088,2.192207813,0.327834725
5415,acclaimed,11,The niece acclaimed the nephew because,-58,0,1.748594761,2.329664946,-0.581070185
5416,accompanied,11,The nephew accompanied the niece because,-48,1,1.776775718,2.148654461,0.371878743
5417,accompanied,11,The niece accompanied the nephew because,-48,0,1.91888237,1.903538704,0.015343666
5418,accused,11,The nephew accused the niece because,2,1,1.910679936,2.037760019,0.127080083
5419,accused,11,The niece accused the nephew because,2,0,1.845026255,2.426597118,-0.581570863
5420,admired,11,The nephew admired the niece because,-92,1,2.039633036,1.63771069,-0.401922346
5421,admired,11,The niece admired the nephew because,-92,0,1.459065557,2.352880001,-0.893814444
5422,admonished,11,The nephew admonished the niece because,-32,1,2.270379543,2.134950638,-0.135428905
5423,admonished,11,The niece admonished the nephew because,-32,0,1.840222359,2.574216843,-0.733994484
5424,adored,11,The nephew adored the niece because,-74,1,2.142524719,1.584062696,-0.558462023
5425,adored,11,The niece adored the nephew because,-74,0,1.431913853,2.27897644,-0.847062587
5426,advised,11,The nephew advised the niece because,-28,1,2.03917408,2.506900787,0.467726707
5427,advised,11,The niece advised the nephew because,-28,0,2.2119596,2.346915245,-0.134955645
5428,affected,11,The nephew affected the niece because,29,1,1.955926538,2.150385141,0.194458603
5429,affected,11,The niece affected the nephew because,29,0,1.923056364,2.133089781,-0.210033417
5430,aggravated,11,The nephew aggravated the niece because,59,1,1.537330031,2.038451672,0.501121641
5431,aggravated,11,The niece aggravated the nephew because,59,0,1.76710701,1.775631785,-0.008524775
5432,agitated,11,The nephew agitated the niece because,85,1,1.799536347,1.860613585,0.061077238
5433,agitated,11,The niece agitated the nephew because,85,0,1.698288918,2.066282272,-0.367993354
5434,alarmed,11,The nephew alarmed the niece because,58,1,1.624399066,2.224593639,0.600194573
5435,alarmed,11,The niece alarmed the nephew because,58,0,1.914104342,1.9433496,-0.029245258
5436,alienated,11,The nephew alienated the niece because,41,1,1.687843561,2.164727926,0.476884365
5437,alienated,11,The niece alienated the nephew because,41,0,1.88655591,1.857360244,0.029195666
5438,amazed,11,The nephew amazed the niece because,68,1,1.568030715,1.981372476,0.413341761
5439,amazed,11,The niece amazed the nephew because,68,0,1.597891331,1.992785454,-0.394894123
5440,amused,11,The nephew amused the niece because,67,1,1.641252875,1.989907265,0.34865439
5441,amused,11,The niece amused the nephew because,67,0,1.668255806,1.955018282,-0.286762476
5442,angered,11,The nephew angered the niece because,85,1,1.438656926,2.004400015,0.565743089
5443,angered,11,The niece angered the nephew because,85,0,1.670210123,1.707336545,-0.037126422
5444,annoyed,11,The nephew annoyed the niece because,79,1,1.632373452,1.760119438,0.127745986
5445,annoyed,11,The niece annoyed the nephew because,79,0,1.558997512,1.861400723,-0.302403211
5446,answered,11,The nephew answered the niece because,-64,1,1.668408513,1.852762938,0.184354425
5447,answered,11,The niece answered the nephew because,-64,0,1.772195578,1.808067083,-0.035871505
5448,apologized to,11,The nephew apologized to the niece because,93,1,1.560506463,2.284748793,0.72424233
5449,apologized to,11,The niece apologized to the nephew because,93,0,2.006731033,1.82178247,0.184948563
5450,appalled,11,The nephew appalled the niece because,78,1,1.602383256,2.181389809,0.579006553
