,verb,item,sent,bias,subject_gender,surprisal_he,surprisal_she,subject_preference
1668,dreamed about,3,The uncle dreamed about the aunt because,30,1,2.26903224,1.480300665,-0.788731575
1669,dreamed about,3,The aunt dreamed about the uncle because,30,0,1.887428761,1.627380013,0.260048748
1670,echoed,3,The uncle echoed the aunt because,72,1,2.2079916,1.831412792,-0.376578808
1671,echoed,3,The aunt echoed the uncle because,72,0,2.391535282,1.724055648,0.667479634
1672,embraced,3,The uncle embraced the aunt because,29,1,1.920274734,1.546942949,-0.373331785
1673,embraced,3,The aunt embraced the uncle because,29,0,1.90573442,1.528473258,0.377261162
1674,employed,3,The uncle employed the aunt because,-76,1,2.14310503,1.508469701,-0.634635329
1675,employed,3,The aunt employed the uncle because,-76,0,1.799838543,1.694524646,0.105313897
1676,encouraged,3,The uncle encouraged the aunt because,-12,1,2.127140045,1.779179335,-0.34796071
1677,encouraged,3,The aunt encouraged the uncle because,-12,0,1.84851408,1.96362412,-0.11511004
1678,enlightened,3,The uncle enlightened the aunt because,0,1,1.874271631,1.885817766,0.011546135
1679,enlightened,3,The aunt enlightened the uncle because,0,0,2.25010252,1.725117922,0.524984598
1680,enraged,3,The uncle enraged the aunt because,70,1,1.702552557,1.710301399,0.007748842
1681,enraged,3,The aunt enraged the uncle because,70,0,1.677941322,1.730411172,-0.05246985
1682,enticed,3,The uncle enticed the aunt because,70,1,1.88359797,1.709392071,-0.174205899
1683,enticed,3,The aunt enticed the uncle because,70,0,1.716346264,1.763180494,-0.04683423
1684,escorted,3,The uncle escorted the aunt because,-36,1,2.188971758,1.540798068,-0.64817369
1685,escorted,3,The aunt escorted the uncle because,-36,0,1.821641088,1.835641861,-0.014000773
1686,esteemed,3,The uncle esteemed the aunt because,-53,1,2.298538208,1.332353473,-0.966184735
1687,esteemed,3,The aunt esteemed the uncle because,-53,0,1.428584576,2.080401421,-0.651816845
1688,exalted,3,The uncle exalted the aunt because,-17,1,2.577097893,1.405700445,-1.171397448
1689,exalted,3,The aunt exalted the uncle because,-17,0,1.662875891,2.093377352,-0.430501461
1690,exasperated,3,The uncle exasperated the aunt because,74,1,1.983686447,1.845153689,-0.138532758
1691,exasperated,3,The aunt exasperated the uncle because,74,0,1.864680886,1.986868501,-0.122187615
1692,excited,3,The uncle excited the aunt because,72,1,1.817061663,1.686387897,-0.130673766
1693,excited,3,The aunt excited the uncle because,72,0,1.589805484,1.767753959,-0.177948475
1694,excused,3,The uncle excused the aunt because,-50,1,2.786217451,1.432436109,-1.353781342
1695,excused,3,The aunt excused the uncle because,-50,0,1.956611514,1.829812169,0.126799345
1696,exhausted,3,The uncle exhausted the aunt because,65,1,2.174736977,1.546221733,-0.628515244
1697,exhausted,3,The aunt exhausted the uncle because,65,0,2.013626575,1.732620835,0.28100574
1698,fascinated,3,The uncle fascinated the aunt because,85,1,1.777283549,1.686520696,-0.090762853
1699,fascinated,3,The aunt fascinated the uncle because,85,0,1.89474082,1.572767258,0.321973562
1700,favoured,3,The uncle favoured the aunt because,-89,1,2.648156881,1.422077298,-1.226079583
1701,favoured,3,The aunt favoured the uncle because,-89,0,1.834219813,1.833746433,0.00047338
1702,feared,3,The uncle feared the aunt because,-85,1,2.830628395,1.642412543,-1.188215852
1703,feared,3,The aunt feared the uncle because,-85,0,1.888890982,2.110239506,-0.221348524
1704,fed,3,The uncle fed the aunt because,-85,1,2.032605648,1.414513588,-0.61809206
1705,fed,3,The aunt fed the uncle because,-85,0,1.907528639,1.542232037,0.365296602
1706,filmed,3,The uncle filmed the aunt because,-3,1,1.902463198,1.506292224,-0.396170974
1707,filmed,3,The aunt filmed the uncle because,-3,0,2.199775219,1.299697876,0.900077343
1708,flattered,3,The uncle flattered the aunt because,42,1,2.072597504,2.060555935,-0.012041569
1709,flattered,3,The aunt flattered the uncle because,42,0,1.975682378,2.072091818,-0.09640944
1710,floored,3,The uncle floored the aunt because,13,1,1.955290318,1.707635403,-0.247654915
1711,floored,3,The aunt floored the uncle because,13,0,1.743934751,1.878163815,-0.134229064
1712,followed,3,The uncle followed the aunt because,46,1,2.252764702,1.510394216,-0.742370486
1713,followed,3,The aunt followed the uncle because,46,0,1.758958578,1.746047497,0.012911081
1714,fooled,3,The uncle fooled the aunt because,10,1,1.615194559,1.757546544,0.142351985
1715,fooled,3,The aunt fooled the uncle because,10,0,1.851133347,1.614122033,0.237011314
1716,forgave,3,The uncle forgave the aunt because,5,1,2.140000105,1.303256273,-0.836743832
1717,forgave,3,The aunt forgave the uncle because,5,0,1.679690599,1.572032213,0.107658386
1718,forgot,3,The uncle forgot the aunt because,-16,1,1.992835879,1.514927745,-0.477908134
1719,forgot,3,The aunt forgot the uncle because,-16,0,1.887100339,1.527582288,0.359518051
1720,fought,3,The uncle fought the aunt because,24,1,1.895196795,1.611692429,-0.283504366
1721,fought,3,The aunt fought the uncle because,24,0,1.826325417,1.704567194,0.121758223
1722,freed,3,The uncle freed the aunt because,-52,1,2.29365325,1.455368519,-0.838284731
1723,freed,3,The aunt freed the uncle because,-52,0,1.782107592,1.864945412,-0.08283782
1724,frightened,3,The uncle frightened the aunt because,68,1,2.021377802,1.36282444,-0.658553362
1725,frightened,3,The aunt frightened the uncle because,68,0,1.573801637,1.76760006,-0.193798423
1726,frustrated,3,The uncle frustrated the aunt because,79,1,1.901889443,1.761056304,-0.140833139
1727,frustrated,3,The aunt frustrated the uncle because,79,0,1.875482321,1.880061269,-0.004578948
1728,grabbed,3,The uncle grabbed the aunt because,-5,1,2.080491066,1.219664216,-0.86082685
1729,grabbed,3,The aunt grabbed the uncle because,-5,0,1.339004159,1.774623752,-0.435619593
1730,grazed,3,The uncle grazed the aunt because,44,1,1.981460094,1.644715309,-0.336744785
1731,grazed,3,The aunt grazed the uncle because,44,0,1.735067248,1.856176019,-0.121108771
1732,greeted,3,The uncle greeted the aunt because,-8,1,2.006278992,1.403992891,-0.602286101
1733,greeted,3,The aunt greeted the uncle because,-8,0,1.745658994,1.596977949,0.148681045
1734,guided,3,The uncle guided the aunt because,-73,1,2.18762517,1.784233689,-0.403391481
1735,guided,3,The aunt guided the uncle because,-73,0,2.026300192,1.875648975,0.150651217
1736,hailed,3,The uncle hailed the aunt because,-45,1,2.817972898,1.306913972,-1.511058926
1737,hailed,3,The aunt hailed the uncle because,-45,0,1.525800943,2.22727561,-0.701474667
1738,harassed,3,The uncle harassed the aunt because,41,1,2.129870892,1.439463735,-0.690407157
1739,harassed,3,The aunt harassed the uncle because,41,0,1.850172997,1.684431195,0.165741802
1740,harmed,3,The uncle harmed the aunt because,52,1,1.92880547,1.644222498,-0.284582972
1741,harmed,3,The aunt harmed the uncle because,52,0,2.091240168,1.602897644,0.488342524
1742,hated,3,The uncle hated the aunt because,-91,1,2.622648001,1.057501435,-1.565146566
1743,hated,3,The aunt hated the uncle because,-91,0,1.508648634,1.598167658,-0.089519024
1744,haunted,3,The uncle haunted the aunt because,20,1,2.064738989,1.529319763,-0.535419226
1745,haunted,3,The aunt haunted the uncle because,20,0,1.890697837,1.668424606,0.222273231
1746,helped,3,The uncle helped the aunt because,-49,1,2.025151968,1.589202285,-0.435949683
1747,helped,3,The aunt helped the uncle because,-49,0,1.927058101,1.597522974,0.329535127
1748,hired,3,The uncle hired the aunt because,-65,1,2.073296309,1.467686176,-0.605610133
1749,hired,3,The aunt hired the uncle because,-65,0,1.904057741,1.538177848,0.365879893
1750,hit,3,The uncle hit the aunt because,-14,1,1.976973772,1.490524292,-0.48644948
1751,hit,3,The aunt hit the uncle because,-14,0,1.535506606,1.891447425,-0.355940819
1752,honoured,3,The uncle honoured the aunt because,-57,1,2.367264509,1.31116426,-1.056100249
1753,honoured,3,The aunt honoured the uncle because,-57,0,1.559829116,1.934558749,-0.374729633
1754,hugged,3,The uncle hugged the aunt because,12,1,1.950332284,1.58182168,-0.368510604
1755,hugged,3,The aunt hugged the uncle because,12,0,1.669041157,1.811536431,-0.142495274
1756,hurt,3,The uncle hurt the aunt because,47,1,1.895201206,1.540845275,-0.354355931
1757,hurt,3,The aunt hurt the uncle because,47,0,1.614517212,1.837087512,-0.2225703
1758,idolized,3,The uncle idolized the aunt because,-66,1,2.42251873,1.536056995,-0.886461735
1759,idolized,3,The aunt idolized the uncle because,-66,0,1.980146408,1.659857035,0.320289373
1760,incensed,3,The uncle incensed the aunt because,57,1,1.99593699,1.808434606,-0.187502384
1761,incensed,3,The aunt incensed the uncle because,57,0,1.815901637,2.017844915,-0.201943278
1762,infuriated,3,The uncle infuriated the aunt because,75,1,1.743218064,1.6462363,-0.096981764
1763,infuriated,3,The aunt infuriated the uncle because,75,0,1.777372122,1.688205242,0.08916688
1764,inspired,3,The uncle inspired the aunt because,78,1,2.052728653,1.62666285,-0.426065803
1765,inspired,3,The aunt inspired the uncle because,78,0,2.033565044,1.570637465,0.462927579
1766,instructed,3,The uncle instructed the aunt because,-17,1,2.21985507,1.914358854,-0.305496216
1767,instructed,3,The aunt instructed the uncle because,-17,0,2.227952957,1.852640033,0.375312924
1768,insulted,3,The uncle insulted the aunt because,6,1,2.177331209,1.374675989,-0.80265522
1769,insulted,3,The aunt insulted the uncle because,6,0,1.664617896,1.743922472,-0.079304576
1770,interrupted,3,The uncle interrupted the aunt because,3,1,2.214254856,1.609481454,-0.604773402
1771,interrupted,3,The aunt interrupted the uncle because,3,0,1.864811182,1.782655716,0.082155466
1772,intimidated,3,The uncle intimidated the aunt because,73,1,1.918356776,1.372822285,-0.545534491
1773,intimidated,3,The aunt intimidated the uncle because,73,0,1.624296069,1.627730131,-0.003434062
1774,intrigued,3,The uncle intrigued the aunt because,76,1,1.830320954,1.805379272,-0.024941682
1775,intrigued,3,The aunt intrigued the uncle because,76,0,1.949241042,1.660519361,0.288721681
1776,irritated,3,The uncle irritated the aunt because,81,1,1.9164083,1.650217652,-0.266190648
1777,irritated,3,The aunt irritated the uncle because,81,0,1.741292477,1.826882124,-0.085589647
1778,killed,3,The uncle killed the aunt because,5,1,1.795307279,1.434094071,-0.361213208
1779,killed,3,The aunt killed the uncle because,5,0,1.653343081,1.65452075,-0.001177669
1780,kissed,3,The uncle kissed the aunt because,61,1,1.829131961,1.550492525,-0.278639436
1781,kissed,3,The aunt kissed the uncle because,61,0,1.650121212,1.635074854,0.015046358
1782,lauded,3,The uncle lauded the aunt because,-37,1,3.069270372,1.297673225,-1.771597147
1783,lauded,3,The aunt lauded the uncle because,-37,0,1.527802944,2.491582632,-0.963779688
1784,laughed at,3,The uncle laughed at the aunt because,-96,1,1.99294281,1.546602488,-0.446340322
1785,laughed at,3,The aunt laughed at the uncle because,-96,0,1.673023224,1.826503396,-0.153480172
1786,led,3,The uncle led the aunt because,-30,1,2.257260561,1.566193104,-0.691067457
1787,led,3,The aunt led the uncle because,-30,0,1.767095923,1.925341964,-0.158246041
1788,left,3,The uncle left the aunt because,2,1,2.414540052,1.441145778,-0.973394274
1789,left,3,The aunt left the uncle because,2,0,2.004044056,1.658449769,0.345594287
1790,lied to,3,The uncle lied to the aunt because,78,1,1.36013186,1.91383338,0.55370152
1791,lied to,3,The aunt lied to the uncle because,78,0,3.030993462,1.007475734,2.023517728
1792,liked,3,The uncle liked the aunt because,-91,1,3.156675816,0.836236358,-2.320439458
1793,liked,3,The aunt liked the uncle because,-91,0,1.253774524,1.807894349,-0.554119825
1794,loathed,3,The uncle loathed the aunt because,-85,1,2.952817678,1.215748668,-1.73706901
1795,loathed,3,The aunt loathed the uncle because,-85,0,1.577705145,1.870945215,-0.29324007
1796,loved,3,The uncle loved the aunt because,-80,1,2.850847483,0.915638149,-1.935209334
1797,loved,3,The aunt loved the uncle because,-80,0,1.241419554,1.849164963,-0.607745409
1798,married,3,The uncle married the aunt because,53,1,2.158507824,1.958974838,-0.199532986
1799,married,3,The aunt married the uncle because,53,0,2.227238417,1.893861771,0.333376646
1800,met,3,The uncle met the aunt because,53,1,1.931839466,1.650305271,-0.281534195
1801,met,3,The aunt met the uncle because,53,0,2.079810381,1.479879737,0.599930644
1802,missed,3,The uncle missed the aunt because,-45,1,2.250497818,1.590733767,-0.659764051
1803,missed,3,The aunt missed the uncle because,-45,0,1.973848104,1.667867661,0.305980443
1804,mocked,3,The uncle mocked the aunt because,-33,1,2.883495092,1.308332086,-1.575163006
1805,mocked,3,The aunt mocked the uncle because,-33,0,1.711079478,1.972823262,-0.261743784
1806,mourned,3,The uncle mourned the aunt because,-72,1,2.800075054,1.542339683,-1.257735371
1807,mourned,3,The aunt mourned the uncle because,-72,0,1.79490602,2.277756453,-0.482850433
1808,moved,3,The uncle moved the aunt because,-11,1,2.382983446,1.634206891,-0.748776555
1809,moved,3,The aunt moved the uncle because,-11,0,2.036184311,1.781594992,0.254589319
1810,noticed,3,The uncle noticed the aunt because,-92,1,2.906873465,1.254607439,-1.652266026
1811,noticed,3,The aunt noticed the uncle because,-92,0,1.700717807,1.759769917,-0.05905211
1812,ordered around,3,The uncle ordered around the aunt because,53,1,2.467829704,1.56915009,-0.898679614
1813,ordered around,3,The aunt ordered around the uncle because,53,0,1.815704346,1.849264264,-0.033559918
1814,pacified,3,The uncle pacified the aunt because,-49,1,2.082342148,1.781105399,-0.301236749
1815,pacified,3,The aunt pacified the uncle because,-49,0,1.875615835,1.998166561,-0.122550726
1816,pardoned,3,The uncle pardoned the aunt because,-38,1,2.21019721,1.514958143,-0.695239067
1817,pardoned,3,The aunt pardoned the uncle because,-38,0,1.856408238,1.843001842,0.013406396
1818,passed,3,The uncle passed the aunt because,0,1,2.090182781,1.534764051,-0.55541873
1819,passed,3,The aunt passed the uncle because,0,0,2.049050093,1.610645771,0.438404322
1820,penalized,3,The uncle penalized the aunt because,-77,1,2.564002037,1.434717178,-1.129284859
1821,penalized,3,The aunt penalized the uncle because,-77,0,1.857323885,1.865887284,-0.008563399
1822,persecuted,3,The uncle persecuted the aunt because,-22,1,2.413282394,1.29524684,-1.118035554
1823,persecuted,3,The aunt persecuted the uncle because,-22,0,1.866877913,1.677130103,0.18974781
1824,picked up,3,The uncle picked up the aunt because,-71,1,2.39476943,1.186036706,-1.208732724
1825,picked up,3,The aunt picked up the uncle because,-71,0,1.53787899,1.717577457,-0.179698467
1826,plagued,3,The uncle plagued the aunt because,58,1,2.261772394,1.77739203,-0.484380364
1827,plagued,3,The aunt plagued the uncle because,58,0,2.07025075,1.918097019,0.152153731
1828,played,3,The uncle played the aunt because,43,1,2.263397932,1.401954889,-0.861443043
1829,played,3,The aunt played the uncle because,43,0,2.190112829,1.518296361,0.671816468
1830,played with,3,The uncle played with the aunt because,-13,1,1.999767303,1.739179254,-0.260588049
1831,played with,3,The aunt played with the uncle because,-13,0,2.087568283,1.712013364,0.375554919
1832,pleased,3,The uncle pleased the aunt because,83,1,1.827360749,1.629225612,-0.198135137
1833,pleased,3,The aunt pleased the uncle because,83,0,1.753808975,1.799157262,-0.045348287
1834,praised,3,The uncle praised the aunt because,-87,1,2.99840951,1.167512298,-1.830897212
1835,praised,3,The aunt praised the uncle because,-87,0,1.448235273,2.299794436,-0.851559163
1836,prized,3,The uncle prized the aunt because,-74,1,2.733236074,1.2802881,-1.452947974
1837,prized,3,The aunt prized the uncle because,-74,0,1.616815567,1.868400097,-0.25158453
1838,prosecuted,3,The uncle prosecuted the aunt because,-44,1,2.385798931,1.582670212,-0.803128719
1839,prosecuted,3,The aunt prosecuted the uncle because,-44,0,1.988041878,1.914097548,0.07394433
1840,protected,3,The uncle protected the aunt because,-47,1,2.206756592,1.538792491,-0.667964101
1841,protected,3,The aunt protected the uncle because,-47,0,1.886660218,1.704088807,0.182571411
1842,provoked,3,The uncle provoked the aunt because,70,1,1.66039741,1.657238364,-0.003159046
1843,provoked,3,The aunt provoked the uncle because,70,0,1.658099055,1.63726294,0.020836115
1844,punished,3,The uncle punished the aunt because,-76,1,2.449385881,1.196856976,-1.252528905
1845,punished,3,The aunt punished the uncle because,-76,0,1.60753417,1.750524759,-0.142990589
1846,pursued,3,The uncle pursued the aunt because,31,1,2.065991163,1.496857882,-0.569133281
1847,pursued,3,The aunt pursued the uncle because,31,0,1.693092465,1.747103333,-0.054010868
1848,questioned,3,The uncle questioned the aunt because,26,1,2.727142811,1.642116547,-1.085026264
1849,questioned,3,The aunt questioned the uncle because,26,0,1.97498095,2.045084,-0.07010305
1850,reassured,3,The uncle reassured the aunt because,-62,1,2.010441065,2.218812466,0.208371401
1851,reassured,3,The aunt reassured the uncle because,-62,0,2.257654667,1.959929466,0.297725201
1852,rebuked,3,The uncle rebuked the aunt because,-18,1,2.700443506,1.431535959,-1.268907547
1853,rebuked,3,The aunt rebuked the uncle because,-18,0,1.801386476,2.009262562,-0.207876086
1854,relaxed,3,The uncle relaxed the aunt because,19,1,2.126460791,1.706250787,-0.420210004
1855,relaxed,3,The aunt relaxed the uncle because,19,0,1.985861182,1.796179414,0.189681768
1856,relished,3,The uncle relished the aunt because,-47,1,2.157689571,1.485476851,-0.67221272
1857,relished,3,The aunt relished the uncle because,-47,0,1.653557181,1.853541374,-0.199984193
1858,repaid,3,The uncle repaid the aunt because,63,1,1.6683079,1.619085073,-0.049222827
1859,repaid,3,The aunt repaid the uncle because,63,0,1.778968692,1.546118021,0.232850671
1860,repelled,3,The uncle repelled the aunt because,67,1,2.332448959,1.55449307,-0.777955889
1861,repelled,3,The aunt repelled the uncle because,67,0,1.877254963,1.781340957,0.095914006
1862,reprimanded,3,The uncle reprimanded the aunt because,-50,1,2.712850571,1.548167467,-1.164683104
1863,reprimanded,3,The aunt reprimanded the uncle because,-50,0,1.746068835,2.179123878,-0.433055043
1864,repulsed,3,The uncle repulsed the aunt because,76,1,2.036129236,1.585826397,-0.450302839
1865,repulsed,3,The aunt repulsed the uncle because,76,0,1.768331289,1.779415131,-0.011083842
1866,resented,3,The uncle resented the aunt because,-76,1,2.208645105,1.472438335,-0.73620677
1867,resented,3,The aunt resented the uncle because,-76,0,1.990181684,1.588298202,0.401883482
1868,respected,3,The uncle respected the aunt because,-91,1,2.162281036,1.352328062,-0.809952974
1869,respected,3,The aunt respected the uncle because,-91,0,1.636660814,1.771704316,-0.135043502
1870,revered,3,The uncle revered the aunt because,-57,1,2.511960983,1.336238027,-1.175722956
1871,revered,3,The aunt revered the uncle because,-57,0,1.664215565,1.889372468,-0.225156903
1872,revitalized,3,The uncle revitalized the aunt because,3,1,2.346401691,1.606672764,-0.739728927
1873,revitalized,3,The aunt revitalized the uncle because,3,0,2.041254044,1.751277566,0.289976478
1874,revolted,3,The uncle revolted the aunt because,66,1,2.151431322,1.514473557,-0.636957765
1875,revolted,3,The aunt revolted the uncle because,66,0,2.102089643,1.623455167,0.478634476
1876,rewarded,3,The uncle rewarded the aunt because,-85,1,1.888894677,1.33214438,-0.556750297
1877,rewarded,3,The aunt rewarded the uncle because,-85,0,1.443025708,1.727796078,-0.28477037
1878,ridiculed,3,The uncle ridiculed the aunt because,-58,1,2.932086229,1.337484956,-1.594601273
1879,ridiculed,3,The aunt ridiculed the uncle because,-58,0,1.714608669,1.958235264,-0.243626595
1880,rushed to,3,The uncle rushed to the aunt because,-32,1,1.800760508,1.724515796,-0.076244712
1881,rushed to,3,The aunt rushed to the uncle because,-32,0,2.094874382,1.551772475,0.543101907
1882,saluted,3,The uncle saluted the aunt because,-48,1,2.458841324,1.398734689,-1.060106635
1883,saluted,3,The aunt saluted the uncle because,-48,0,1.517531395,2.080852985,-0.56332159
1884,scared,3,The uncle scared the aunt because,74,1,2.161394835,1.319521904,-0.841872931
1885,scared,3,The aunt scared the uncle because,74,0,1.529619932,1.822139025,-0.292519093
1886,scolded,3,The uncle scolded the aunt because,-69,1,2.700843811,1.491417766,-1.209426045
1887,scolded,3,The aunt scolded the uncle because,-69,0,1.774003148,2.027535915,-0.253532767
1888,scorned,3,The uncle scorned the aunt because,-49,1,2.768239737,1.279348731,-1.488891006
1889,scorned,3,The aunt scorned the uncle because,-49,0,1.648553729,1.888041735,-0.239488006
1890,shadowed,3,The uncle shadowed the aunt because,58,1,2.116382599,1.753617644,-0.362764955
1891,shadowed,3,The aunt shadowed the uncle because,58,0,2.120206594,1.737199903,0.383006691
1892,shocked,3,The uncle shocked the aunt because,56,1,1.771455526,1.700780272,-0.070675254
1893,shocked,3,The aunt shocked the uncle because,56,0,1.65102005,1.851092339,-0.200072289
1894,shook,3,The uncle shook the aunt because,-47,1,2.029178381,1.567967653,-0.461210728
1895,shook,3,The aunt shook the uncle because,-47,0,1.549180984,2.041629314,-0.49244833
1896,snubbed,3,The uncle snubbed the aunt because,20,1,2.044914484,1.618034244,-0.42688024
1897,snubbed,3,The aunt snubbed the uncle because,20,0,1.907541275,1.731233001,0.176308274
1898,staggered,3,The uncle staggered the aunt because,64,1,1.769521594,1.837324023,0.067802429
1899,staggered,3,The aunt staggered the uncle because,64,0,1.940501451,1.799305081,0.14119637
1900,startled,3,The uncle startled the aunt because,35,1,1.690077543,1.769051909,0.078974366
1901,startled,3,The aunt startled the uncle because,35,0,1.667844057,1.795656085,-0.127812028
1902,stimulated,3,The uncle stimulated the aunt because,30,1,1.87699461,1.607743979,-0.269250631
1903,stimulated,3,The aunt stimulated the uncle because,30,0,1.73407042,1.598773837,0.135296583
1904,struck,3,The uncle struck the aunt because,-8,1,2.116927147,1.531955004,-0.584972143
1905,struck,3,The aunt struck the uncle because,-8,0,1.576696515,1.919506192,-0.342809677
1906,sued,3,The uncle sued the aunt because,-77,1,2.138017178,1.668375254,-0.469641924
1907,sued,3,The aunt sued the uncle because,-77,0,1.843973994,1.810634017,0.033339977
1908,supported,3,The uncle supported the aunt because,-29,1,1.986496449,1.694747806,-0.291748643
1909,supported,3,The aunt supported the uncle because,-29,0,2.099947691,1.585265636,0.514682055
1910,surprised,3,The uncle surprised the aunt because,10,1,1.772392869,1.664360166,-0.108032703
1911,surprised,3,The aunt surprised the uncle because,10,0,1.712845683,1.746768951,-0.033923268
1912,tailed,3,The uncle tailed the aunt because,58,1,2.019882917,1.730060697,-0.28982222
1913,tailed,3,The aunt tailed the uncle because,58,0,1.872846603,1.907088995,-0.034242392
1914,telephoned,3,The uncle telephoned the aunt because,82,1,1.956919909,1.805652142,-0.151267767
1915,telephoned,3,The aunt telephoned the uncle because,82,0,2.109455824,1.693516612,0.415939212
1916,thanked,3,The uncle thanked the aunt because,-92,1,2.462182045,1.247021317,-1.215160728
1917,thanked,3,The aunt thanked the uncle because,-92,0,1.544986606,1.909820914,-0.364834308
1918,tolerated,3,The uncle tolerated the aunt because,4,1,2.250363111,1.317077875,-0.933285236
1919,tolerated,3,The aunt tolerated the uncle because,4,0,1.824459076,1.526117206,0.29834187
1920,took away,3,The uncle took away the aunt because,-50,1,2.322849751,1.296842575,-1.026007176
1921,took away,3,The aunt took away the uncle because,-50,0,1.592122912,1.754111171,-0.161988259
1922,tormented,3,The uncle tormented the aunt because,45,1,2.183830976,1.541854143,-0.641976833
1923,tormented,3,The aunt tormented the uncle because,45,0,1.866352677,1.797317386,0.069035291
1924,tracked,3,The uncle tracked the aunt because,36,1,2.636107683,1.391569853,-1.24453783
1925,tracked,3,The aunt tracked the uncle because,36,0,1.804800987,1.898227572,-0.093426585
1926,trailed,3,The uncle trailed the aunt because,66,1,1.970765233,1.876788378,-0.093976855
1927,trailed,3,The aunt trailed the uncle because,66,0,2.003883362,1.826991677,0.176891685
1928,treasured,3,The uncle treasured the aunt because,-76,1,2.560432434,1.328244209,-1.232188225
1929,treasured,3,The aunt treasured the uncle because,-76,0,1.639661074,1.820900559,-0.181239485
1930,troubled,3,The uncle troubled the aunt because,68,1,1.958757997,1.833312511,-0.125445486
1931,troubled,3,The aunt troubled the uncle because,68,0,1.919733405,1.937333465,-0.01760006
1932,trusted,3,The uncle trusted the aunt because,-49,1,1.950024247,1.576263309,-0.373760938
1933,trusted,3,The aunt trusted the uncle because,-49,0,1.74441576,1.68942523,0.05499053
1934,unnerved,3,The uncle unnerved the aunt because,70,1,1.891611814,1.753992677,-0.137619137
1935,unnerved,3,The aunt unnerved the uncle because,70,0,1.901320696,1.835070252,0.066250444
1936,unsettled,3,The uncle unsettled the aunt because,62,1,2.086918592,1.947450399,-0.139468193
1937,unsettled,3,The aunt unsettled the uncle because,62,0,2.0505867,2.034703732,0.015882968
1938,uplifted,3,The uncle uplifted the aunt because,-1,1,2.49460721,1.731048226,-0.763558984
1939,uplifted,3,The aunt uplifted the uncle because,-1,0,1.895250678,2.180846453,-0.285595775
1940,upset,3,The uncle upset the aunt because,66,1,1.929332972,1.560921431,-0.368411541
1941,upset,3,The aunt upset the uncle because,66,0,1.680437922,1.830010653,-0.149572731
1942,valued,3,The uncle valued the aunt because,-98,1,2.731559753,1.2325809,-1.498978853
1943,valued,3,The aunt valued the uncle because,-98,0,1.560494542,1.839166999,-0.278672457
1944,venerated,3,The uncle venerated the aunt because,-32,1,2.88368082,1.254650235,-1.629030585
1945,venerated,3,The aunt venerated the uncle because,-32,0,1.736404777,1.772463441,-0.036058664
