,verb,item,sent,bias,subject_gender,surprisal_he,surprisal_she,subject_preference
0,abandoned,0,The man abandoned the woman because,33,1,1.43002224,1.416417718,-0.013604522
1,abandoned,0,The woman abandoned the man because,33,0,1.402688384,1.51499176,-0.112303376
2,acclaimed,0,The man acclaimed the woman because,-58,1,1.639303803,2.250923872,0.611620069
3,acclaimed,0,The woman acclaimed the man because,-58,0,1.749077559,1.708874822,0.040202737
4,accompanied,0,The man accompanied the woman because,-48,1,1.403665304,1.746100664,0.34243536
5,accompanied,0,The woman accompanied the man because,-48,0,1.632408381,1.382772207,0.249636174
6,accused,0,The man accused the woman because,2,1,1.315040112,1.694337487,0.379297375
7,accused,0,The woman accused the man because,2,0,1.387568474,1.602791667,-0.215223193
8,admired,0,The man admired the woman because,-92,1,1.667497873,1.318937182,-0.348560691
9,admired,0,The woman admired the man because,-92,0,1.169163227,1.925011754,-0.755848527
10,admonished,0,The man admonished the woman because,-32,1,1.853698134,1.413356662,-0.440341472
11,admonished,0,The woman admonished the man because,-32,0,1.337562561,1.990194082,-0.652631521
12,adored,0,The man adored the woman because,-74,1,1.557473063,1.385270238,-0.172202825
13,adored,0,The woman adored the man because,-74,0,1.165647388,1.805973291,-0.640325903
14,advised,0,The man advised the woman because,-28,1,1.561671972,1.736483335,0.174811363
15,advised,0,The woman advised the man because,-28,0,1.633035183,1.706495285,-0.073460102
16,affected,0,The man affected the woman because,29,1,1.428088427,1.83501327,0.406924843
17,affected,0,The woman affected the man because,29,0,1.651625633,1.637569785,0.014055848
18,aggravated,0,The man aggravated the woman because,59,1,1.193828106,1.64912796,0.455299854
19,aggravated,0,The woman aggravated the man because,59,0,1.395077348,1.434680104,-0.039602756
20,agitated,0,The man agitated the woman because,85,1,1.508297324,1.202746034,-0.30555129
21,agitated,0,The woman agitated the man because,85,0,1.191913009,1.606729746,-0.414816737
22,alarmed,0,The man alarmed the woman because,58,1,1.226085782,1.759435654,0.533349872
23,alarmed,0,The woman alarmed the man because,58,0,1.504291296,1.473703146,0.03058815
24,alienated,0,The man alienated the woman because,41,1,1.236929536,1.851014853,0.614085317
25,alienated,0,The woman alienated the man because,41,0,1.516287446,1.487900734,0.028386712
26,amazed,0,The man amazed the woman because,68,1,1.290717602,1.602432966,0.311715364
27,amazed,0,The woman amazed the man because,68,0,1.287723899,1.635893822,-0.348169923
28,amused,0,The man amused the woman because,67,1,1.332625031,1.558244348,0.225619317
29,amused,0,The woman amused the man because,67,0,1.342515707,1.605943561,-0.263427854
30,angered,0,The man angered the woman because,85,1,1.085462689,1.726955175,0.641492486
31,angered,0,The woman angered the man because,85,0,1.469401836,1.272279501,0.197122335
32,annoyed,0,The man annoyed the woman because,79,1,1.292842865,1.475502133,0.182659268
33,annoyed,0,The woman annoyed the man because,79,0,1.236351132,1.587636232,-0.3512851
34,answered,0,The man answered the woman because,-64,1,1.322970986,1.458322763,0.135351777
35,answered,0,The woman answered the man because,-64,0,1.476920128,1.375909925,0.101010203
36,apologized to,0,The man apologized to the woman because,93,1,1.276032567,1.65702498,0.380992413
37,apologized to,0,The woman apologized to the man because,93,0,1.373943329,1.546817422,-0.172874093
38,appalled,0,The man appalled the woman because,78,1,1.138292551,1.977788091,0.83949554
39,appalled,0,The woman appalled the man because,78,0,1.559298038,1.476328135,0.082969903
40,applauded,0,The man applauded the woman because,-84,1,1.614345431,1.395605564,-0.218739867
41,applauded,0,The woman applauded the man because,-84,0,1.170868039,1.966148734,-0.795280695
42,appreciated,0,The man appreciated the woman because,-87,1,1.543819308,1.251256108,-0.2925632
43,appreciated,0,The woman appreciated the man because,-87,0,1.170430064,1.702216864,-0.5317868
44,approached,0,The man approached the woman because,39,1,1.282569528,1.3306036,0.048034072
45,approached,0,The woman approached the man because,39,0,1.431039691,1.19365406,0.237385631
46,astonished,0,The man astonished the woman because,51,1,1.158843756,1.791145444,0.632301688
47,astonished,0,The woman astonished the man because,51,0,1.382839203,1.512500405,-0.129661202
48,astounded,0,The man astounded the woman because,62,1,1.287335157,1.780113697,0.49277854
49,astounded,0,The woman astounded the man because,62,0,1.515730262,1.543830872,-0.02810061
50,attracted,0,The man attracted the woman because,87,1,1.312994599,1.816064596,0.503069997
51,attracted,0,The woman attracted the man because,87,0,1.870802522,1.191484928,0.679317594
52,avoided,0,The man avoided the woman because,14,1,1.423466802,1.595592499,0.172125697
53,avoided,0,The woman avoided the man because,14,0,1.539095521,1.396193027,0.142902494
54,baffled,0,The man baffled the woman because,56,1,1.302053213,1.730683446,0.428630233
55,baffled,0,The woman baffled the man because,56,0,1.449032187,1.539266706,-0.090234519
56,banished,0,The man banished the woman because,-56,1,1.309918165,1.641764879,0.331846714
57,banished,0,The woman banished the man because,-56,0,1.377952099,1.53316021,-0.155208111
58,battled,0,The man battled the woman because,47,1,1.533254862,1.492562532,-0.04069233
59,battled,0,The woman battled the man because,47,0,1.528848648,1.521881223,0.006967425
60,believed,0,The man believed the woman because,-54,1,1.362821937,1.565921068,0.203099131
61,believed,0,The woman believed the man because,-54,0,1.276276827,1.637005448,-0.360728621
62,betrayed,0,The man betrayed the woman because,74,1,1.089032888,1.926822424,0.837789536
63,betrayed,0,The woman betrayed the man because,74,0,1.653692603,1.254472733,0.39921987
64,bewildered,0,The man bewildered the woman because,49,1,1.387909889,1.671414375,0.283504486
65,bewildered,0,The woman bewildered the man because,49,0,1.387912035,1.703655601,-0.315743566
66,blamed,0,The man blamed the woman because,-30,1,1.430241942,1.627111077,0.196869135
67,blamed,0,The woman blamed the man because,-30,0,1.384693503,1.703111768,-0.318418265
68,blessed,0,The man blessed the woman because,-21,1,1.530590773,1.492264748,-0.038326025
69,blessed,0,The woman blessed the man because,-21,0,1.414675832,1.746775746,-0.332099914
70,bored,0,The man bored the woman because,73,1,1.390337467,1.364988685,-0.025348782
71,bored,0,The woman bored the man because,73,0,1.228207469,1.62914443,-0.400936961
72,bothered,0,The man bothered the woman because,59,1,1.411254406,1.391651034,-0.019603372
73,bothered,0,The woman bothered the man because,59,0,1.32355237,1.455293894,-0.131741524
74,called,0,The man called the woman because,82,1,1.297947407,1.469324827,0.17137742
75,called,0,The woman called the man because,82,0,1.2248981,1.53967309,-0.31477499
76,calmed,0,The man calmed the woman because,-53,1,1.509267569,1.462884665,-0.046382904
77,calmed,0,The woman calmed the man because,-53,0,1.356650472,1.704303026,-0.347652554
78,calmed down,0,The man calmed down the woman because,-79,1,1.538304329,1.418406248,-0.119898081
79,calmed down,0,The woman calmed down the man because,-79,0,1.325193286,1.694606662,-0.369413376
80,captivated,0,The man captivated the woman because,78,1,1.360729456,1.461310506,0.10058105
81,captivated,0,The woman captivated the man because,78,0,1.440594435,1.323084831,0.117509604
82,carried,0,The man carried the woman because,-92,1,1.415237665,1.613515735,0.19827807
83,carried,0,The woman carried the man because,-92,0,1.442567348,1.5055269,-0.062959552
84,castigated,0,The man castigated the woman because,-45,1,1.651903272,1.348146081,-0.303757191
85,castigated,0,The woman castigated the man because,-45,0,1.20066452,1.833241463,-0.632576943
86,caught,0,The man caught the woman because,-44,1,1.266052485,1.544482589,0.278430104
87,caught,0,The woman caught the man because,-44,0,1.461901426,1.291294694,0.170606732
88,cautioned,0,The man cautioned the woman because,-36,1,1.873435974,1.640210986,-0.233224988
89,cautioned,0,The woman cautioned the man because,-36,0,1.564735174,2.052703619,-0.487968445
90,celebrated,0,The man celebrated the woman because,-72,1,1.388803482,1.596591592,0.20778811
91,celebrated,0,The woman celebrated the man because,-72,0,1.357841492,1.684118867,-0.326277375
92,censured,0,The man censured the woman because,-58,1,1.578521132,1.331675172,-0.24684596
93,censured,0,The woman censured the man because,-58,0,1.199278235,1.796578288,-0.597300053
94,charmed,0,The man charmed the woman because,81,1,1.377211452,1.503317356,0.126105904
95,charmed,0,The woman charmed the man because,81,0,1.433534384,1.466731191,-0.033196807
96,chased,0,The man chased the woman because,-33,1,1.382551432,1.244007826,-0.138543606
97,chased,0,The woman chased the man because,-33,0,1.164324522,1.495664835,-0.331340313
98,cheated,0,The man cheated the woman because,63,1,1.182520628,1.72604084,0.543520212
99,cheated,0,The woman cheated the man because,63,0,1.435406923,1.432413101,0.002993822
100,cheered,0,The man cheered the woman because,-48,1,1.561968446,1.443325162,-0.118643284
101,cheered,0,The woman cheered the man because,-48,0,1.189800858,2.010606527,-0.820805669
102,cherished,0,The man cherished the woman because,-53,1,1.53181994,1.487748265,-0.044071675
103,cherished,0,The woman cherished the man because,-53,0,1.356707215,1.665494442,-0.308787227
104,chilled,0,The man chilled the woman because,31,1,1.515051961,1.424124122,-0.090927839
105,chilled,0,The woman chilled the man because,31,0,1.307368994,1.726302147,-0.418933153
106,comforted,0,The man comforted the woman because,-77,1,1.534037471,1.632460952,0.098423481
107,comforted,0,The woman comforted the man because,-77,0,1.556944132,1.63902247,-0.082078338
108,commended,0,The man commended the woman because,-82,1,1.83009851,1.251251698,-0.578846812
109,commended,0,The woman commended the man because,-82,0,1.118881702,2.208244562,-1.08936286
110,compensated,0,The man compensated the woman because,16,1,1.34647572,1.578456998,0.231981278
111,compensated,0,The woman compensated the man because,16,0,1.415760636,1.495384336,-0.0796237
112,complemented,0,The man complemented the woman because,-56,1,1.557723284,2.197829008,0.640105724
113,complemented,0,The woman complemented the man because,-56,0,2.128771067,1.643719435,0.485051632
114,complimented,0,The man complimented the woman because,-47,1,1.614700794,1.605807185,-0.008893609
115,complimented,0,The woman complimented the man because,-47,0,1.426764369,1.827943444,-0.401179075
116,concerned,0,The man concerned the woman because,81,1,1.31940639,1.811722636,0.492316246
117,concerned,0,The woman concerned the man because,81,0,1.482266784,1.64587307,-0.163606286
118,condemned,0,The man condemned the woman because,-63,1,1.677294493,1.296901941,-0.380392552
119,condemned,0,The woman condemned the man because,-63,0,1.042609572,2.275772095,-1.233162523
120,confessed to,0,The man confessed to the woman because,74,1,1.077832222,1.873256207,0.795423985
121,confessed to,0,The woman confessed to the man because,74,0,1.790524483,1.090277195,0.700247288
122,confided in,0,The man confided in the woman because,5,1,1.337329268,1.668515563,0.331186295
123,confided in,0,The woman confided in the man because,5,0,1.731023192,1.317131042,0.41389215
124,confounded,0,The man confounded the woman because,36,1,1.271244407,1.6863693,0.415124893
125,confounded,0,The woman confounded the man because,36,0,1.442804217,1.533412933,-0.090608716
126,confused,0,The man confused the woman because,60,1,1.349500895,1.607315063,0.257814168
127,confused,0,The woman confused the man because,60,0,1.240556598,1.760742188,-0.52018559
128,congratulated,0,The man congratulated the woman because,-94,1,1.546813488,1.611908197,0.065094709
129,congratulated,0,The woman congratulated the man because,-94,0,1.361718655,1.85436511,-0.492646455
130,consulted,0,The man consulted the woman because,13,1,1.350038886,1.717757225,0.367718339
131,consulted,0,The woman consulted the man because,13,0,1.753856063,1.316211104,0.437644959
132,corrected,0,The man corrected the woman because,-74,1,1.478258491,1.729853988,0.251595497
133,corrected,0,The woman corrected the man because,-74,0,1.420851231,1.729462385,-0.308611154
134,corrupted,0,The man corrupted the woman because,38,1,1.291211128,1.779366732,0.488155604
135,corrupted,0,The woman corrupted the man because,38,0,1.468680739,1.576449156,-0.107768417
136,counseled,0,The man counseled the woman because,-67,1,1.685186982,1.85178721,0.166600228
137,counseled,0,The woman counseled the man because,-67,0,1.661955118,1.951205254,-0.289250136
138,courted,0,The man courted the woman because,33,1,1.396839261,1.587643743,0.190804482
139,courted,0,The woman courted the man because,33,0,1.719102025,1.252553105,0.46654892
140,criticized,0,The man criticized the woman because,-45,1,1.793030262,1.268618107,-0.524412155
141,criticized,0,The woman criticized the man because,-45,0,1.184920788,1.909124494,-0.724203706
142,dated,0,The man dated the woman because,15,1,1.499868155,1.632446051,0.132577896
143,dated,0,The woman dated the man because,15,0,1.66832149,1.476768613,0.191552877
144,debated with,0,The man debated with the woman because,27,1,1.412822485,2.03587842,0.623055935
145,debated with,0,The woman debated with the man because,27,0,1.797139764,1.452029824,0.34510994
146,deceived,0,The man deceived the woman because,63,1,1.085644603,1.813783288,0.728138685
147,deceived,0,The woman deceived the man because,63,0,1.431702375,1.35667932,0.075023055
148,decried,0,The man decried the woman because,-11,1,1.734525681,1.386410713,-0.348114968
149,decried,0,The woman decried the man because,-11,0,1.239661455,2.068623304,-0.828961849
150,defied,0,The man defied the woman because,27,1,1.160122514,1.886203051,0.726080537
151,defied,0,The woman defied the man because,27,0,1.946085215,1.113171935,0.83291328
152,delighted,0,The man delighted the woman because,85,1,1.259845138,1.745447159,0.485602021
153,delighted,0,The woman delighted the man because,85,0,1.457896471,1.529628396,-0.071731925
154,denounced,0,The man denounced the woman because,-36,1,1.758773208,1.205154181,-0.553619027
155,denounced,0,The woman denounced the man because,-36,0,1.053661466,2.093933582,-1.040272116
156,deplored,0,The man deplored the woman because,-34,1,1.710109711,1.414068341,-0.29604137
157,deplored,0,The woman deplored the man because,-34,0,1.227023363,2.065440178,-0.838416815
158,deprecated,0,The man deprecated the woman because,-12,1,1.363351583,1.769769907,0.406418324
159,deprecated,0,The woman deprecated the man because,-12,0,1.592859864,1.555304289,0.037555575
160,derided,0,The man derided the woman because,-24,1,2.154527903,1.015122056,-1.139405847
161,derided,0,The woman derided the man because,-24,0,0.91902113,2.409332037,-1.490310907
162,deserted,0,The man deserted the woman because,36,1,1.380544424,1.353467464,-0.02707696
163,deserted,0,The woman deserted the man because,36,0,1.457709193,1.379571199,0.078137994
164,despised,0,The man despised the woman because,-87,1,1.600008965,1.384604096,-0.215404869
165,despised,0,The woman despised the man because,-87,0,1.205473185,1.838380337,-0.632907152
166,detested,0,The man detested the woman because,-78,1,1.564190388,1.422933578,-0.14125681
167,detested,0,The woman detested the man because,-78,0,1.36278069,1.696911454,-0.334130764
168,disappointed,0,The man disappointed the woman because,73,1,1.224921823,1.879193425,0.654271602
169,disappointed,0,The woman disappointed the man because,73,0,1.533424497,1.576285243,-0.042860746
170,discouraged,0,The man discouraged the woman because,36,1,1.507612109,1.346680403,-0.160931706
171,discouraged,0,The woman discouraged the man because,36,0,1.327895641,1.535232425,-0.207336784
172,disgruntled,0,The man disgruntled the woman because,58,1,1.244250059,1.660904884,0.416654825
173,disgruntled,0,The woman disgruntled the man because,58,0,1.3982898,1.470263958,-0.071974158
174,disliked,0,The man disliked the woman because,-87,1,1.711356163,1.286270142,-0.425086021
175,disliked,0,The woman disliked the man because,-87,0,1.254314542,1.72613585,-0.471821308
176,disobeyed,0,The man disobeyed the woman because,55,1,1.204669833,1.625837207,0.421167374
177,disobeyed,0,The woman disobeyed the man because,55,0,1.555652857,1.33127737,0.224375487
178,disparaged,0,The man disparaged the woman because,12,1,1.789460421,1.439854145,-0.349606276
179,disparaged,0,The woman disparaged the man because,12,0,1.311823606,1.907340288,-0.595516682
180,distracted,0,The man distracted the woman because,53,1,1.348979712,1.648301005,0.299321293
181,distracted,0,The woman distracted the man because,53,0,1.375551939,1.560665846,-0.185113907
182,distressed,0,The man distressed the woman because,60,1,1.415088534,1.525366426,0.110277892
183,distressed,0,The woman distressed the man because,60,0,1.333014369,1.685454965,-0.352440596
184,distrusted,0,The man distrusted the woman because,-75,1,1.588185906,1.490136504,-0.098049402
185,distrusted,0,The woman distrusted the man because,-75,0,1.375045657,1.650900364,-0.275854707
186,divorced,0,The man divorced the woman because,-21,1,1.42231822,1.698084712,0.275766492
187,divorced,0,The woman divorced the man because,-21,0,1.479570389,1.605610251,-0.126039862
188,dominated,0,The man dominated the woman because,3,1,1.423319221,1.758280754,0.334961533
189,dominated,0,The woman dominated the man because,3,0,1.545405865,1.510216832,0.035189033
190,dreaded,0,The man dreaded the woman because,-73,1,1.626598716,1.494152784,-0.132445932
191,dreaded,0,The woman dreaded the man because,-73,0,1.340171218,1.765158176,-0.424986958
192,dreamed about,0,The man dreamed about the woman because,30,1,1.305649161,1.818867564,0.513218403
193,dreamed about,0,The woman dreamed about the man because,30,0,1.51995492,1.56762588,-0.04767096
194,echoed,0,The man echoed the woman because,72,1,1.528423548,1.922998548,0.394575
195,echoed,0,The woman echoed the man because,72,0,1.97971344,1.486681819,0.493031621
196,embraced,0,The man embraced the woman because,29,1,1.39508462,1.512990355,0.117905735
197,embraced,0,The woman embraced the man because,29,0,1.484414577,1.432242036,0.052172541
198,employed,0,The man employed the woman because,-76,1,1.339602351,1.644482255,0.304879904
199,employed,0,The woman employed the man because,-76,0,1.571268439,1.421949029,0.14931941
200,encouraged,0,The man encouraged the woman because,-12,1,1.425856113,1.528550506,0.102694393
201,encouraged,0,The woman encouraged the man because,-12,0,1.355519414,1.591760278,-0.236240864
202,enlightened,0,The man enlightened the woman because,0,1,1.268236756,1.900142193,0.631905437
203,enlightened,0,The woman enlightened the man because,0,0,1.552397966,1.572540522,-0.020142556
204,enraged,0,The man enraged the woman because,70,1,1.097618103,1.679475307,0.581857204
205,enraged,0,The woman enraged the man because,70,0,1.372893691,1.351628542,0.021265149
206,enticed,0,The man enticed the woman because,70,1,1.328515649,1.533926368,0.205410719
207,enticed,0,The woman enticed the man because,70,0,1.356664896,1.456717491,-0.100052595
208,escorted,0,The man escorted the woman because,-36,1,1.55643332,1.371066451,-0.185366869
209,escorted,0,The woman escorted the man because,-36,0,1.217231631,1.707049251,-0.48981762
210,esteemed,0,The man esteemed the woman because,-53,1,1.473577023,2.342758179,0.869181156
211,esteemed,0,The woman esteemed the man because,-53,0,1.504182696,1.927160859,-0.422978163
212,exalted,0,The man exalted the woman because,-17,1,1.52207756,1.808201671,0.286124111
213,exalted,0,The woman exalted the man because,-17,0,1.371409535,1.981917739,-0.610508204
214,exasperated,0,The man exasperated the woman because,74,1,1.411943316,1.627381086,0.21543777
215,exasperated,0,The woman exasperated the man because,74,0,1.379811406,1.729049087,-0.349237681
216,excited,0,The man excited the woman because,72,1,1.280619025,1.579775214,0.299156189
217,excited,0,The woman excited the man because,72,0,1.295413017,1.546876431,-0.251463414
218,excused,0,The man excused the woman because,-50,1,1.451035976,1.53140831,0.080372334
219,excused,0,The woman excused the man because,-50,0,1.305312276,1.785961032,-0.480648756
220,exhausted,0,The man exhausted the woman because,65,1,1.546099663,1.442326546,-0.103773117
221,exhausted,0,The woman exhausted the man because,65,0,1.407947779,1.71079123,-0.302843451
222,fascinated,0,The man fascinated the woman because,85,1,1.214545608,1.987944722,0.773399114
223,fascinated,0,The woman fascinated the man because,85,0,1.655037522,1.387746215,0.267291307
224,favoured,0,The man favoured the woman because,-89,1,1.38995409,1.798860073,0.408905983
225,favoured,0,The woman favoured the man because,-89,0,1.578796148,1.580414057,-0.001617909
226,feared,0,The man feared the woman because,-85,1,1.592527509,1.467159152,-0.125368357
227,feared,0,The woman feared the man because,-85,0,1.453661799,1.592106342,-0.138444543
228,fed,0,The man fed the woman because,-85,1,1.35214138,1.475803852,0.123662472
229,fed,0,The woman fed the man because,-85,0,1.515181661,1.3350209,0.180160761
230,filmed,0,The man filmed the woman because,-3,1,1.149861336,1.588441849,0.438580513
231,filmed,0,The woman filmed the man because,-3,0,1.632416606,1.12425065,0.508165956
232,flattered,0,The man flattered the woman because,42,1,1.374734163,1.684115767,0.309381604
233,flattered,0,The woman flattered the man because,42,0,1.437930942,1.657661438,-0.219730496
234,floored,0,The man floored the woman because,13,1,1.397558331,1.616430163,0.218871832
235,floored,0,The woman floored the man because,13,0,1.391047001,1.661277056,-0.270230055
236,followed,0,The man followed the woman because,46,1,1.416297793,1.46098578,0.044687987
237,followed,0,The woman followed the man because,46,0,1.300696254,1.522341967,-0.221645713
238,fooled,0,The man fooled the woman because,10,1,1.146766901,1.72560823,0.578841329
239,fooled,0,The woman fooled the man because,10,0,1.324808598,1.48999989,-0.165191292
240,forgave,0,The man forgave the woman because,5,1,1.366142988,1.472271442,0.106128454
241,forgave,0,The woman forgave the man because,5,0,1.259556651,1.594044924,-0.334488273
242,forgot,0,The man forgot the woman because,-16,1,1.249945164,1.73761642,0.487671256
243,forgot,0,The woman forgot the man because,-16,0,1.479995728,1.483055592,-0.003059864
244,fought,0,The man fought the woman because,24,1,1.280911446,1.407732844,0.126821398
245,fought,0,The woman fought the man because,24,0,1.260895371,1.439768434,-0.178873063
246,freed,0,The man freed the woman because,-52,1,1.426345468,1.64707756,0.220732092
247,freed,0,The woman freed the man because,-52,0,1.393250585,1.650283575,-0.25703299
248,frightened,0,The man frightened the woman because,68,1,1.255495429,1.421193242,0.165697813
249,frightened,0,The woman frightened the man because,68,0,1.168955445,1.581251502,-0.412296057
250,frustrated,0,The man frustrated the woman because,79,1,1.33134377,1.622718215,0.291374445
251,frustrated,0,The woman frustrated the man because,79,0,1.362861753,1.651869535,-0.289007782
252,grabbed,0,The man grabbed the woman because,-5,1,1.461603165,1.085101604,-0.376501561
253,grabbed,0,The woman grabbed the man because,-5,0,1.026455045,1.614916325,-0.58846128
254,grazed,0,The man grazed the woman because,44,1,1.490557671,1.444042444,-0.046515227
255,grazed,0,The woman grazed the man because,44,0,1.31058991,1.714190602,-0.403600692
256,greeted,0,The man greeted the woman because,-8,1,1.335969448,1.36501658,0.029047132
257,greeted,0,The woman greeted the man because,-8,0,1.411775827,1.30065012,0.111125707
258,guided,0,The man guided the woman because,-73,1,1.562763333,1.77623105,0.213467717
259,guided,0,The woman guided the man because,-73,0,1.516256452,1.744297147,-0.228040695
260,hailed,0,The man hailed the woman because,-45,1,1.395195723,1.588939071,0.193743348
261,hailed,0,The woman hailed the man because,-45,0,1.280748725,1.732653022,-0.451904297
262,harassed,0,The man harassed the woman because,41,1,1.304605484,1.421795845,0.117190361
263,harassed,0,The woman harassed the man because,41,0,1.360869765,1.353638172,0.007231593
264,harmed,0,The man harmed the woman because,52,1,1.25386405,1.870844364,0.616980314
265,harmed,0,The woman harmed the man because,52,0,1.509493709,1.557483673,-0.047989964
266,hated,0,The man hated the woman because,-91,1,1.656613708,1.188369751,-0.468243957
267,hated,0,The woman hated the man because,-91,0,1.105948806,1.792767763,-0.686818957
268,haunted,0,The man haunted the woman because,20,1,1.481932521,1.529328227,0.047395706
269,haunted,0,The woman haunted the man because,20,0,1.38171649,1.704713702,-0.322997212
270,helped,0,The man helped the woman because,-49,1,1.37528789,1.672396779,0.297108889
271,helped,0,The woman helped the man because,-49,0,1.56082356,1.391174316,0.169649244
272,hired,0,The man hired the woman because,-65,1,1.22551024,1.772728801,0.547218561
273,hired,0,The woman hired the man because,-65,0,1.709203124,1.260826349,0.448376775
274,hit,0,The man hit the woman because,-14,1,1.273903847,1.423575521,0.149671674
275,hit,0,The woman hit the man because,-14,0,1.109020829,1.707542539,-0.59852171
276,honoured,0,The man honoured the woman because,-57,1,1.205086589,1.758017659,0.55293107
277,honoured,0,The woman honoured the man because,-57,0,1.313996315,1.67478013,-0.360783815
278,hugged,0,The man hugged the woman because,12,1,1.444056273,1.463285327,0.019229054
279,hugged,0,The woman hugged the man because,12,0,1.317834973,1.620260239,-0.302425266
280,hurt,0,The man hurt the woman because,47,1,1.262053847,1.666743994,0.404690147
281,hurt,0,The woman hurt the man because,47,0,1.257639647,1.678444028,-0.420804381
282,idolized,0,The man idolized the woman because,-66,1,1.417632699,1.927152634,0.509519935
