,verb,item,sent,bias,subject_gender,surprisal_he,surprisal_she,subject_preference
3285,moved,6,The princess moved the prince because,-11,0,1.868129253,1.718842745,0.149286508
3286,noticed,6,The prince noticed the princess because,-92,1,1.899938822,1.672085166,-0.227853656
3287,noticed,6,The princess noticed the prince because,-92,0,1.70977819,1.787762046,-0.077983856
3288,ordered around,6,The prince ordered around the princess because,53,1,1.815529466,1.966676116,0.15114665
3289,ordered around,6,The princess ordered around the prince because,53,0,1.764824986,1.773322225,-0.008497239
3290,pacified,6,The prince pacified the princess because,-49,1,1.679432631,2.026281595,0.346848964
3291,pacified,6,The princess pacified the prince because,-49,0,1.891970515,1.836143494,0.055827021
3292,pardoned,6,The prince pardoned the princess because,-38,1,1.676164508,1.994505763,0.318341255
3293,pardoned,6,The princess pardoned the prince because,-38,0,1.767341375,1.960523248,-0.193181873
3294,passed,6,The prince passed the princess because,0,1,1.595640421,2.086899996,0.491259575
3295,passed,6,The princess passed the prince because,0,0,1.884480596,1.826254249,0.058226347
3296,penalized,6,The prince penalized the princess because,-77,1,1.936080575,1.739145398,-0.196935177
3297,penalized,6,The princess penalized the prince because,-77,0,1.709653735,2.017032146,-0.307378411
3298,persecuted,6,The prince persecuted the princess because,-22,1,1.899275184,1.632468224,-0.26680696
3299,persecuted,6,The princess persecuted the prince because,-22,0,1.907916188,1.655286074,0.252630114
3300,picked up,6,The prince picked up the princess because,-71,1,1.621614337,1.663198471,0.041584134
3301,picked up,6,The princess picked up the prince because,-71,0,1.61950624,1.63384819,-0.01434195
3302,plagued,6,The prince plagued the princess because,58,1,1.893113017,2.123955011,0.230841994
3303,plagued,6,The princess plagued the prince because,58,0,2.144240379,1.792608857,0.351631522
3304,played,6,The prince played the princess because,43,1,1.547835588,1.960406899,0.412571311
3305,played,6,The princess played the prince because,43,0,2.038730383,1.496828198,0.541902185
3306,played with,6,The prince played with the princess because,-13,1,1.619012356,1.970154166,0.35114181
3307,played with,6,The princess played with the prince because,-13,0,1.906061172,1.641345382,0.26471579
3308,pleased,6,The prince pleased the princess because,83,1,1.478597999,1.948559046,0.469961047
3309,pleased,6,The princess pleased the prince because,83,0,1.811986327,1.62778604,0.184200287
3310,praised,6,The prince praised the princess because,-87,1,2.084074736,1.527071118,-0.557003618
3311,praised,6,The princess praised the prince because,-87,0,1.626548886,2.082421303,-0.455872417
3312,prized,6,The prince prized the princess because,-74,1,2.165267229,1.489163518,-0.676103711
3313,prized,6,The princess prized the prince because,-74,0,1.656130672,1.807051659,-0.150920987
3314,prosecuted,6,The prince prosecuted the princess because,-44,1,1.805296302,1.928683639,0.123387337
3315,prosecuted,6,The princess prosecuted the prince because,-44,0,1.921111226,1.934990883,-0.013879657
3316,protected,6,The prince protected the princess because,-47,1,1.698330402,1.794354439,0.096024037
3317,protected,6,The princess protected the prince because,-47,0,1.850991845,1.63403511,0.216956735
3318,provoked,6,The prince provoked the princess because,70,1,1.484538317,1.948489904,0.463951587
3319,provoked,6,The princess provoked the prince because,70,0,1.82750845,1.554526567,0.272981883
3320,punished,6,The prince punished the princess because,-76,1,1.876026034,1.551245689,-0.324780345
3321,punished,6,The princess punished the prince because,-76,0,1.584038973,1.85447824,-0.270439267
3322,pursued,6,The prince pursued the princess because,31,1,1.59184885,1.62155652,0.02970767
3323,pursued,6,The princess pursued the prince because,31,0,1.821346521,1.475443959,0.345902562
3324,questioned,6,The prince questioned the princess because,26,1,2.047637224,1.968695879,-0.078941345
3325,questioned,6,The princess questioned the prince because,26,0,2.006757259,2.007021427,-0.000264168
3326,reassured,6,The prince reassured the princess because,-62,1,1.741683125,2.444627047,0.702943922
3327,reassured,6,The princess reassured the prince because,-62,0,2.187652588,1.894990563,0.292662025
3328,rebuked,6,The prince rebuked the princess because,-18,1,1.975071788,1.726679325,-0.248392463
3329,rebuked,6,The princess rebuked the prince because,-18,0,1.785564303,2.059900045,-0.274335742
3330,relaxed,6,The prince relaxed the princess because,19,1,1.762025952,1.981040955,0.219015003
3331,relaxed,6,The princess relaxed the prince because,19,0,1.91642797,1.866434693,0.049993277
3332,relished,6,The prince relished the princess because,-47,1,1.849562883,1.558144331,-0.291418552
3333,relished,6,The princess relished the prince because,-47,0,1.686551571,1.776037693,-0.089486122
3334,repaid,6,The prince repaid the princess because,63,1,1.547925949,1.908137321,0.360211372
3335,repaid,6,The princess repaid the prince because,63,0,1.75016737,1.697972655,0.052194715
3336,repelled,6,The prince repelled the princess because,67,1,1.780805111,1.914461851,0.13365674
3337,repelled,6,The princess repelled the prince because,67,0,1.985404849,1.734734058,0.250670791
3338,reprimanded,6,The prince reprimanded the princess because,-50,1,2.052782059,1.796695709,-0.25608635
3339,reprimanded,6,The princess reprimanded the prince because,-50,0,1.782750845,2.140595675,-0.35784483
3340,repulsed,6,The prince repulsed the princess because,76,1,1.682068586,1.788879395,0.106810809
3341,repulsed,6,The princess repulsed the prince because,76,0,1.801915884,1.673641682,0.128274202
3342,resented,6,The prince resented the princess because,-76,1,1.709345222,1.791753769,0.082408547
3343,resented,6,The princess resented the prince because,-76,0,1.833389401,1.685974121,0.14741528
3344,respected,6,The prince respected the princess because,-91,1,1.747354031,1.667223811,-0.08013022
3345,respected,6,The princess respected the prince because,-91,0,1.759458184,1.603160262,0.156297922
3346,revered,6,The prince revered the princess because,-57,1,1.950968385,1.703929782,-0.247038603
3347,revered,6,The princess revered the prince because,-57,0,1.812200427,1.73544395,0.076756477
3348,revitalized,6,The prince revitalized the princess because,3,1,1.755078197,2.102928877,0.34785068
3349,revitalized,6,The princess revitalized the prince because,3,0,2.060315371,1.781191826,0.279123545
3350,revolted,6,The prince revolted the princess because,66,1,1.707276225,1.85441637,0.147140145
3351,revolted,6,The princess revolted the prince because,66,0,1.97750628,1.761837125,0.215669155
3352,rewarded,6,The prince rewarded the princess because,-85,1,1.562091827,1.590918779,0.028826952
3353,rewarded,6,The princess rewarded the prince because,-85,0,1.538302183,1.712420106,-0.174117923
3354,ridiculed,6,The prince ridiculed the princess because,-58,1,2.135249853,1.581273079,-0.553976774
3355,ridiculed,6,The princess ridiculed the prince because,-58,0,1.691640735,1.939945221,-0.248304486
3356,rushed to,6,The prince rushed to the princess because,-32,1,1.516501427,2.092635155,0.576133728
3357,rushed to,6,The princess rushed to the prince because,-32,0,2.044948101,1.570859313,0.474088788
3358,saluted,6,The prince saluted the princess because,-48,1,1.753508925,1.698980927,-0.054527998
3359,saluted,6,The princess saluted the prince because,-48,0,1.565230966,1.979739428,-0.414508462
3360,scared,6,The prince scared the princess because,74,1,1.560426235,1.737306952,0.176880717
3361,scared,6,The princess scared the prince because,74,0,1.612260103,1.638456464,-0.026196361
3362,scolded,6,The prince scolded the princess because,-69,1,1.936084867,1.804662585,-0.131422282
3363,scolded,6,The princess scolded the prince because,-69,0,1.709242702,2.062508821,-0.353266119
3364,scorned,6,The prince scorned the princess because,-49,1,1.965506673,1.591531038,-0.373975635
3365,scorned,6,The princess scorned the prince because,-49,0,1.582779408,1.907658815,-0.324879407
3366,shadowed,6,The prince shadowed the princess because,58,1,1.88061285,2.089931011,0.209318161
3367,shadowed,6,The princess shadowed the prince because,58,0,2.113830805,1.766123056,0.347707749
3368,shocked,6,The prince shocked the princess because,56,1,1.50860858,2.043279409,0.534670829
3369,shocked,6,The princess shocked the prince because,56,0,1.784182072,1.699550152,0.08463192
3370,shook,6,The prince shook the princess because,-47,1,1.711342812,1.901739955,0.190397143
3371,shook,6,The princess shook the prince because,-47,0,1.735847116,1.9440974,-0.208250284
3372,snubbed,6,The prince snubbed the princess because,20,1,1.619312525,1.965523124,0.346210599
3373,snubbed,6,The princess snubbed the prince because,20,0,1.702027559,1.779538035,-0.077510476
3374,staggered,6,The prince staggered the princess because,64,1,1.566390395,2.158120871,0.591730476
3375,staggered,6,The princess staggered the prince because,64,0,1.83349514,1.810072541,0.023422599
3376,startled,6,The prince startled the princess because,35,1,1.53181231,1.987222314,0.455410004
3377,startled,6,The princess startled the prince because,35,0,1.793024898,1.691387296,0.101637602
3378,stimulated,6,The prince stimulated the princess because,30,1,1.521398067,1.878769755,0.357371688
3379,stimulated,6,The princess stimulated the prince because,30,0,1.809924364,1.590754986,0.219169378
3380,struck,6,The prince struck the princess because,-8,1,1.707527161,1.680593371,-0.02693379
3381,struck,6,The princess struck the prince because,-8,0,1.72481823,1.726689458,-0.001871228
3382,sued,6,The prince sued the princess because,-77,1,1.602755666,1.972108364,0.369352698
3383,sued,6,The princess sued the prince because,-77,0,1.865858674,1.853349328,0.012509346
3384,supported,6,The prince supported the princess because,-29,1,1.48698771,2.058300257,0.571312547
3385,supported,6,The princess supported the prince because,-29,0,2.069137573,1.473191738,0.595945835
3386,surprised,6,The prince surprised the princess because,10,1,1.531745672,1.960783124,0.429037452
3387,surprised,6,The princess surprised the prince because,10,0,1.777419329,1.642133713,0.135285616
3388,tailed,6,The prince tailed the princess because,58,1,1.713737488,2.060223341,0.346485853
3389,tailed,6,The princess tailed the prince because,58,0,1.962763667,1.78668654,0.176077127
3390,telephoned,6,The prince telephoned the princess because,82,1,1.562269568,2.130368233,0.568098665
3391,telephoned,6,The princess telephoned the prince because,82,0,2.054047346,1.725337505,0.328709841
3392,thanked,6,The prince thanked the princess because,-92,1,1.656960607,1.600418329,-0.056542278
3393,thanked,6,The princess thanked the prince because,-92,0,1.634573936,1.768780947,-0.134207011
3394,tolerated,6,The prince tolerated the princess because,4,1,1.726256609,1.548110127,-0.178146482
3395,tolerated,6,The princess tolerated the prince because,4,0,1.754053593,1.533321381,0.220732212
3396,took away,6,The prince took away the princess because,-50,1,1.68592751,1.710869193,0.024941683
3397,took away,6,The princess took away the prince because,-50,0,1.593349695,1.80934906,-0.215999365
3398,tormented,6,The prince tormented the princess because,45,1,1.70472455,1.845139384,0.140414834
3399,tormented,6,The princess tormented the prince because,45,0,1.961841702,1.650313616,0.311528086
3400,tracked,6,The prince tracked the princess because,36,1,1.828972578,1.712563634,-0.116408944
3401,tracked,6,The princess tracked the prince because,36,0,1.792164803,1.693873286,0.098291517
3402,trailed,6,The prince trailed the princess because,66,1,1.666726351,2.131723404,0.464997053
3403,trailed,6,The princess trailed the prince because,66,0,2.007059336,1.691414833,0.315644503
3404,treasured,6,The prince treasured the princess because,-76,1,2.083589315,1.516888618,-0.566700697
3405,treasured,6,The princess treasured the prince because,-76,0,1.669405937,1.755512953,-0.086107016
3406,troubled,6,The prince troubled the princess because,68,1,1.726926208,2.088172197,0.361245989
3407,troubled,6,The princess troubled the prince because,68,0,2.035793066,1.77950871,0.256284356
3408,trusted,6,The prince trusted the princess because,-49,1,1.646789789,1.725511074,0.078721285
3409,trusted,6,The princess trusted the prince because,-49,0,1.819376826,1.54355514,0.275821686
3410,unnerved,6,The prince unnerved the princess because,70,1,1.634441376,2.044745207,0.410303831
3411,unnerved,6,The princess unnerved the prince because,70,0,1.969995141,1.68555522,0.284439921
3412,unsettled,6,The prince unsettled the princess because,62,1,1.868301392,2.178640604,0.310339212
3413,unsettled,6,The princess unsettled the prince because,62,0,2.049355507,1.892012119,0.157343388
3414,uplifted,6,The prince uplifted the princess because,-1,1,1.853658915,1.97518599,0.121527075
3415,uplifted,6,The princess uplifted the prince because,-1,0,1.891318917,1.878264666,0.013054251
3416,upset,6,The prince upset the princess because,66,1,1.582475662,1.971106887,0.388631225
3417,upset,6,The princess upset the prince because,66,0,1.789730549,1.715445042,0.074285507
3418,valued,6,The prince valued the princess because,-98,1,2.245843887,1.532806516,-0.713037371
3419,valued,6,The princess valued the prince because,-98,0,1.575101256,1.804908514,-0.229807258
3420,venerated,6,The prince venerated the princess because,-32,1,2.040270567,1.612344742,-0.427925825
3421,venerated,6,The princess venerated the prince because,-32,0,1.894887686,1.697071791,0.197815895
3422,victimized,6,The prince victimized the princess because,15,1,1.365957499,2.000460386,0.634502887
3423,victimized,6,The princess victimized the prince because,15,0,1.810668588,1.551335216,0.259333372
3424,vilified,6,The prince vilified the princess because,26,1,2.219256878,1.650762081,-0.568494797
3425,vilified,6,The princess vilified the prince because,26,0,1.776277542,2.039754868,-0.263477326
3426,visited,6,The prince visited the princess because,-45,1,1.571865201,2.033901453,0.462036252
3427,visited,6,The princess visited the prince because,-45,0,2.138804674,1.532765388,0.606039286
3428,wanted,6,The prince wanted the princess because,-26,1,1.591831446,1.703617334,0.111785888
3429,wanted,6,The princess wanted the prince because,-26,0,1.676218629,1.492293477,0.183925152
3430,warned,6,The prince warned the princess because,-17,1,2.327038288,2.525987864,0.198949576
3431,warned,6,The princess warned the prince because,-17,0,2.520778656,2.410148382,0.110630274
3432,welcomed,6,The prince welcomed the princess because,-17,1,1.573986292,1.86490941,0.290923118
3433,welcomed,6,The princess welcomed the prince because,-17,0,1.870633483,1.552479267,0.318154216
3434,worried,6,The prince worried the princess because,76,1,1.963097215,1.969976425,0.00687921
3435,worried,6,The princess worried the prince because,76,0,1.890270114,1.953889847,-0.063619733
3436,worried about,6,The prince worried about the princess because,-71,1,2.062955141,1.799879432,-0.263075709
3437,worried about,6,The princess worried about the prince because,-71,0,1.813950539,1.836195588,-0.022245049
3438,worshipped,6,The prince worshipped the princess because,-54,1,1.875991225,1.630691767,-0.245299458
3439,worshipped,6,The princess worshipped the prince because,-54,0,1.999903917,1.509095669,0.490808248
3440,wounded,6,The prince wounded the princess because,33,1,1.549662352,1.788247824,0.238585472
3441,wounded,6,The princess wounded the prince because,33,0,1.60030365,1.826737523,-0.226433873
3442,yelled at,6,The prince yelled at the princess because,-57,1,1.723915219,1.621991515,-0.101923704
3443,yelled at,6,The princess yelled at the prince because,-57,0,1.605963111,1.772706509,-0.166743398
3444,abandoned,7,The waiter abandoned the waitress because,33,1,1.663271904,1.459248185,-0.204023719
3445,abandoned,7,The waitress abandoned the waiter because,33,0,1.45097959,1.581136107,-0.130156517
3446,acclaimed,7,The waiter acclaimed the waitress because,-58,1,1.681447506,1.614415526,-0.06703198
3447,acclaimed,7,The waitress acclaimed the waiter because,-58,0,1.379997849,1.915268183,-0.535270334
3448,accompanied,7,The waiter accompanied the waitress because,-48,1,1.548856735,1.626455188,0.077598453
3449,accompanied,7,The waitress accompanied the waiter because,-48,0,1.682271481,1.43485868,0.247412801
3450,accused,7,The waiter accused the waitress because,2,1,1.899762988,1.424755216,-0.475007772
3451,accused,7,The waitress accused the waiter because,2,0,1.475493789,1.765486717,-0.289992928
3452,admired,7,The waiter admired the waitress because,-92,1,1.841595769,1.226035357,-0.615560412
3453,admired,7,The waitress admired the waiter because,-92,0,1.172652125,1.979159832,-0.806507707
3454,admonished,7,The waiter admonished the waitress because,-32,1,2.163770676,1.634284139,-0.529486537
3455,admonished,7,The waitress admonished the waiter because,-32,0,1.682646036,2.048141003,-0.365494967
3456,adored,7,The waiter adored the waitress because,-74,1,1.722716928,1.232734203,-0.489982725
3457,adored,7,The waitress adored the waiter because,-74,0,1.136532426,1.892287612,-0.755755186
3458,advised,7,The waiter advised the waitress because,-28,1,2.164796829,1.923041582,-0.241755247
3459,advised,7,The waitress advised the waiter because,-28,0,2.271741629,1.825379372,0.446362257
3460,affected,7,The waiter affected the waitress because,29,1,1.701122403,1.799017668,0.097895265
3461,affected,7,The waitress affected the waiter because,29,0,1.635560155,1.784340262,-0.148780107
3462,aggravated,7,The waiter aggravated the waitress because,59,1,1.406814218,1.703769207,0.296954989
3463,aggravated,7,The waitress aggravated the waiter because,59,0,1.412798405,1.670469761,-0.257671356
3464,agitated,7,The waiter agitated the waitress because,85,1,1.720570087,1.552164555,-0.168405532
3465,agitated,7,The waitress agitated the waiter because,85,0,1.422786355,1.850293994,-0.427507639
3466,alarmed,7,The waiter alarmed the waitress because,58,1,1.577005506,1.844241858,0.267236352
3467,alarmed,7,The waitress alarmed the waiter because,58,0,1.674523592,1.753355026,-0.078831434
3468,alienated,7,The waiter alienated the waitress because,41,1,1.446531415,1.725401998,0.278870583
3469,alienated,7,The waitress alienated the waiter because,41,0,1.495747328,1.605166912,-0.109419584
3470,amazed,7,The waiter amazed the waitress because,68,1,1.454637527,1.791569471,0.336931944
3471,amazed,7,The waitress amazed the waiter because,68,0,1.419516087,1.806727529,-0.387211442
3472,amused,7,The waiter amused the waitress because,67,1,1.548973322,1.706250787,0.157277465
3473,amused,7,The waitress amused the waiter because,67,0,1.529818654,1.750583887,-0.220765233
3474,angered,7,The waiter angered the waitress because,85,1,1.391015172,1.588830948,0.197815776
3475,angered,7,The waitress angered the waiter because,85,0,1.369072437,1.584950447,-0.21587801
3476,annoyed,7,The waiter annoyed the waitress because,79,1,1.541956186,1.557244778,0.015288592
3477,annoyed,7,The waitress annoyed the waiter because,79,0,1.400609255,1.71488893,-0.314279675
3478,answered,7,The waiter answered the waitress because,-64,1,1.53896606,1.560572624,0.021606564
3479,answered,7,The waitress answered the waiter because,-64,0,1.791602373,1.358294129,0.433308244
3480,apologized to,7,The waiter apologized to the waitress because,93,1,1.532498002,1.744083405,0.211585403
3481,apologized to,7,The waitress apologized to the waiter because,93,0,1.861350894,1.473402023,0.387948871
3482,appalled,7,The waiter appalled the waitress because,78,1,1.521308303,1.775171161,0.253862858
3483,appalled,7,The waitress appalled the waiter because,78,0,1.524461627,1.770333529,-0.245871902
3484,applauded,7,The waiter applauded the waitress because,-84,1,1.857484818,1.413213849,-0.444270969
3485,applauded,7,The waitress applauded the waiter because,-84,0,1.374078155,2.002747536,-0.628669381
3486,appreciated,7,The waiter appreciated the waitress because,-87,1,1.799116611,1.243841171,-0.55527544
3487,appreciated,7,The waitress appreciated the waiter because,-87,0,1.30890429,1.796102166,-0.487197876
3488,approached,7,The waiter approached the waitress because,39,1,1.419056535,1.500947952,0.081891417
3489,approached,7,The waitress approached the waiter because,39,0,1.695125699,1.274255157,0.420870542
3490,astonished,7,The waiter astonished the waitress because,51,1,1.391275406,1.804287076,0.41301167
3491,astonished,7,The waitress astonished the waiter because,51,0,1.4810009,1.699806929,-0.218806029
3492,astounded,7,The waiter astounded the waitress because,62,1,1.564213753,1.92887187,0.364658117
3493,astounded,7,The waitress astounded the waiter because,62,0,1.666569352,1.800633192,-0.13406384
3494,attracted,7,The waiter attracted the waitress because,87,1,1.440069079,1.737178206,0.297109127
3495,attracted,7,The waitress attracted the waiter because,87,0,1.780916452,1.305704951,0.475211501
3496,avoided,7,The waiter avoided the waitress because,14,1,1.498671174,1.574750662,0.076079488
3497,avoided,7,The waitress avoided the waiter because,14,0,1.808568478,1.301536202,0.507032276
3498,baffled,7,The waiter baffled the waitress because,56,1,1.518983841,1.800385833,0.281401992
3499,baffled,7,The waitress baffled the waiter because,56,0,1.55499053,1.749845624,-0.194855094
3500,banished,7,The waiter banished the waitress because,-56,1,1.762511373,1.456552863,-0.30595851
3501,banished,7,The waitress banished the waiter because,-56,0,1.413048863,1.771268129,-0.358219266
3502,battled,7,The waiter battled the waitress because,47,1,1.640225887,1.611872077,-0.02835381
3503,battled,7,The waitress battled the waiter because,47,0,1.553145409,1.653737426,-0.100592017
3504,believed,7,The waiter believed the waitress because,-54,1,1.888581038,1.348473072,-0.540107966
3505,believed,7,The waitress believed the waiter because,-54,0,1.282286286,1.918946862,-0.636660576
3506,betrayed,7,The waiter betrayed the waitress because,74,1,1.182265639,1.888786912,0.706521273
3507,betrayed,7,The waitress betrayed the waiter because,74,0,1.679722309,1.309032321,0.370689988
3508,bewildered,7,The waiter bewildered the waitress because,49,1,1.54115057,1.860526323,0.319375753
3509,bewildered,7,The waitress bewildered the waiter because,49,0,1.552058697,1.827847242,-0.275788545
3510,blamed,7,The waiter blamed the waitress because,-30,1,1.959902167,1.525042057,-0.43486011
3511,blamed,7,The waitress blamed the waiter because,-30,0,1.554462194,1.861158133,-0.306695939
3512,blessed,7,The waiter blessed the waitress because,-21,1,1.750552893,1.542489648,-0.208063245
3513,blessed,7,The waitress blessed the waiter because,-21,0,1.500123858,1.856086612,-0.355962754
3514,bored,7,The waiter bored the waitress because,73,1,1.609777808,1.585573554,-0.024204254
3515,bored,7,The waitress bored the waiter because,73,0,1.360751748,1.82809341,-0.467341662
3516,bothered,7,The waiter bothered the waitress because,59,1,1.699265957,1.550144553,-0.149121404
3517,bothered,7,The waitress bothered the waiter because,59,0,1.528947115,1.637519002,-0.108571887
3518,called,7,The waiter called the waitress because,82,1,1.72529304,1.652218223,-0.073074817
3519,called,7,The waitress called the waiter because,82,0,1.704004407,1.609521389,0.094483018
3520,calmed,7,The waiter calmed the waitress because,-53,1,1.768918991,1.712937951,-0.05598104
3521,calmed,7,The waitress calmed the waiter because,-53,0,1.613978028,1.8617872,-0.247809172
3522,calmed down,7,The waiter calmed down the waitress because,-79,1,1.771334767,1.649290442,-0.122044325
3523,calmed down,7,The waitress calmed down the waiter because,-79,0,1.588043094,1.807674527,-0.219631433
3524,captivated,7,The waiter captivated the waitress because,78,1,1.36145699,1.745025039,0.383568049
3525,captivated,7,The waitress captivated the waiter because,78,0,1.588084459,1.385249615,0.202834844
3526,carried,7,The waiter carried the waitress because,-92,1,1.589398742,1.506252766,-0.083145976
3527,carried,7,The waitress carried the waiter because,-92,0,1.338413358,1.705812335,-0.367398977
3528,castigated,7,The waiter castigated the waitress because,-45,1,2.365171194,1.199915648,-1.165255546
3529,castigated,7,The waitress castigated the waiter because,-45,0,1.277231216,2.122395277,-0.845164061
3530,caught,7,The waiter caught the waitress because,-44,1,1.451312661,1.483155489,0.031842828
3531,caught,7,The waitress caught the waiter because,-44,0,1.382186651,1.520069957,-0.137883306
3532,cautioned,7,The waiter cautioned the waitress because,-36,1,2.314869642,2.054061413,-0.260808229
3533,cautioned,7,The waitress cautioned the waiter because,-36,0,2.222852468,2.153630018,0.06922245
3534,celebrated,7,The waiter celebrated the waitress because,-72,1,1.70396924,1.524931192,-0.179038048
3535,celebrated,7,The waitress celebrated the waiter because,-72,0,1.450184703,1.822151542,-0.371966839
3536,censured,7,The waiter censured the waitress because,-58,1,2.096894264,1.33095789,-0.765936374
3537,censured,7,The waitress censured the waiter because,-58,0,1.323442101,2.070325613,-0.746883512
3538,charmed,7,The waiter charmed the waitress because,81,1,1.507422686,1.76510489,0.257682204
3539,charmed,7,The waitress charmed the waiter because,81,0,1.554007292,1.5964607,-0.042453408
3540,chased,7,The waiter chased the waitress because,-33,1,1.610731363,1.36750102,-0.243230343
3541,chased,7,The waitress chased the waiter because,-33,0,1.219693542,1.821968317,-0.602274775
3542,cheated,7,The waiter cheated the waitress because,63,1,1.370165467,1.849229336,0.479063869
3543,cheated,7,The waitress cheated the waiter because,63,0,1.844095945,1.405724645,0.4383713
3544,cheered,7,The waiter cheered the waitress because,-48,1,1.816286206,1.531703115,-0.284583091
3545,cheered,7,The waitress cheered the waiter because,-48,0,1.400221229,2.021879435,-0.621658206
3546,cherished,7,The waiter cherished the waitress because,-53,1,1.845781446,1.329998732,-0.515782714
